,header,author,last_post,replies,views,topic,lp_date_time,lp_author
0,Official Team Speed Forza Motorsports 3 Tournament,kalifornicationx,10-19-2016 05:28 AM by kalifornicationx,88.0,13838.0,gadgets and gaming,2016-10-19 05:28:00, kalifornicationx
1,"Teamspeed To Go. Download the Teamspeed Mobile app for your iPhone, iPad, or Droid!",TEFF,03-14-2012 12:12 PM by TEFF,12.0,11496.0,gadgets and gaming,2012-03-14 12:12:00, TEFF
2,GTA V Crew,King Hill,06-04-2019 07:24 AM by King Hill,16.0,4666.0,gadgets and gaming,2019-06-04 07:24:00, King Hill
3,Hitman Absolution,watchheights,08-12-2017 06:31 AM by watchheights,4.0,6910.0,gadgets and gaming,2017-08-12 06:31:00, watchheights
4,Best Electric Razor?,RodneyOstby,02-09-2017 06:10 AM by RodneyOstby,16.0,4039.0,gadgets and gaming,2017-02-09 06:10:00, RodneyOst
5,SEGA 'Motorsports Manager' (2016 PC) Review,TeamSpeed Editor,12-20-2016 05:55 PM by TeamSpeed Editor,0.0,1249.0,gadgets and gaming,2016-12-20 17:55:00, TeamSpeed Editor
6,'F1 2016' Review: The Fullest F1 Experience Yet,TeamSpeed Editor,09-21-2016 02:36 PM by TeamSpeed Editor,0.0,1457.0,gadgets and gaming,2016-09-21 14:36:00, TeamSpeed Editor
7,Porsche Expansion Comes to Forza Motorsport 6,TeamSpeed Editor,03-07-2016 05:04 PM by TeamSpeed Editor,0.0,1732.0,gadgets and gaming,2016-03-07 17:04:00, TeamSpeed Editor
8,Forza 6 Gets New Car Pack and We Have One to Give Away!,ozz7240,11-05-2015 01:17 PM by ozz7240,10.0,3472.0,gadgets and gaming,2015-11-05 13:17:00, ozz7240
9,"iPhone 6plus, HTC M9, Apple MacBook pro, Samsung S6, Nikon D800E and more electronics",tbilal294,04-12-2015 04:44 AM by tbilal294,0.0,2332.0,gadgets and gaming,2015-04-12 04:44:00, tbilal294
10,Halo 4 - Who Else Can't Wait??,tempodicorrere,07-22-2014 12:43 PM by tempodicorrere,15.0,4648.0,gadgets and gaming,2014-07-22 12:43:00, tempodicorrere
11,thoughts,joshg120,04-14-2014 08:11 PM by joshg120,4.0,1572.0,gadgets and gaming,2014-04-14 20:11:00, joshg120
12,Headphone vendors on the forum?,Hot Shot,01-18-2014 08:59 PM by Hot Shot,5.0,2109.0,gadgets and gaming,2014-01-18 20:59:00, Hot Shot
13,Worth Sharing: Forza 5 Filmspeed,Mixtape,09-24-2013 03:39 PM by Mixtape,2.0,1851.0,gadgets and gaming,2013-09-24 15:39:00, Mixtape
14,GoPro Super Slashed Pricing,Staf[email protected],09-03-2013 09:23 PM by Staf[email protected],0.0,1507.0,gadgets and gaming,2013-09-03 21:23:00, Staf[email protected]
15,Gta v,Zambrano,07-18-2013 12:46 AM by Zambrano,8.0,2268.0,gadgets and gaming,2013-07-18 00:46:00, Zambrano
16,For those who ride a bicycle :),johan,06-11-2013 02:42 PM by johan,0.0,2111.0,gadgets and gaming,2013-06-11 14:42:00, johan
17,The Official Gran Turismo 5 Thread,Dyna,05-23-2013 06:42 AM by Dyna,2895.0,189455.0,gadgets and gaming,2013-05-23 06:42:00, Dyna
18,Sennheiser IE 800 Earphones - Now Shipping!,SoundEarphones,05-11-2013 01:00 AM by SoundEarphones,0.0,2593.0,gadgets and gaming,2013-05-11 01:00:00, SoundEarphones
19,Forza 4,Dyna,04-30-2013 04:49 PM by Dyna,1859.0,77699.0,gadgets and gaming,2013-04-30 16:49:00, Dyna
20,Borderlands,QYKSLVR,02-15-2013 05:01 AM by QYKSLVR,1.0,1487.0,gadgets and gaming,2013-02-15 05:01:00, QYKSLVR
21,"Guys, I need help setting up the best driving simulator",ThunderRolls,01-06-2013 07:32 PM by ThunderRolls,5.0,4905.0,gadgets and gaming,2013-01-06 19:32:00, ThunderRolls
22,Official Team Speed Forza Motorsports 3 Tournament,kalifornicationx,10-19-2016 05:28 AM by kalifornicationx,88.0,13838.0,gadgets and gaming,2016-10-19 05:28:00, kalifornicationx
23,"Teamspeed To Go. Download the Teamspeed Mobile app for your iPhone, iPad, or Droid!",TEFF,03-14-2012 12:12 PM by TEFF,12.0,11496.0,gadgets and gaming,2012-03-14 12:12:00, TEFF
24,B Class Tournament Score Thread,Bonita,11-22-2012 04:21 AM by Bonita,14.0,2470.0,gadgets and gaming,2012-11-22 04:21:00, Bonita
25,Teamspeed B Class Tournament,X2daC,11-21-2012 10:47 PM by X2daC,99.0,6350.0,gadgets and gaming,2012-11-21 22:47:00, X2daC
26,EMVY Iphone 4 or 4S Battery Case with Built in stand.,TheStigSC,11-20-2012 12:25 PM by TheStigSC,46.0,5515.0,gadgets and gaming,2012-11-20 12:25:00, TheStigSC
27,Mass Effect 3,TheStigSC,11-20-2012 12:18 PM by TheStigSC,6.0,1089.0,gadgets and gaming,2012-11-20 12:18:00, TheStigSC
28,Free Gift Card with a Sennheiser Headphone Purchase,SoundEarphones,11-14-2012 06:06 PM by SoundEarphones,0.0,844.0,gadgets and gaming,2012-11-14 18:06:00, SoundEarphones
29,Forza Horizon,X2daC,11-02-2012 01:54 PM by X2daC,41.0,3916.0,gadgets and gaming,2012-11-02 13:54:00, X2daC
30,The Official Modern Warfare 3 Thread,TheStigSC,11-01-2012 12:27 PM by TheStigSC,540.0,22038.0,gadgets and gaming,2012-11-01 12:27:00, TheStigSC
31,AKG K3003i - Back in stock,SoundEarphones,09-24-2012 11:52 AM by SoundEarphones,0.0,1172.0,gadgets and gaming,2012-09-24 11:52:00, SoundEarphones
32,Denon Headphones & Earphones - Now Available @ SoundEarphones.com,SoundEarphones,09-20-2012 03:01 PM by SoundEarphones,0.0,687.0,gadgets and gaming,2012-09-20 15:01:00, SoundEarphones
33,!! Need an audiophiles help !!,adamls2,09-19-2012 03:38 AM by adamls2,0.0,649.0,gadgets and gaming,2012-09-19 03:38:00, adamls2
34,Wadia 171i idock,SoundEarphones,09-15-2012 10:31 AM by SoundEarphones,1.0,878.0,gadgets and gaming,2012-09-15 10:31:00, SoundEarphones
35,Teamspeed Cup Car Tournament,81911,09-14-2012 08:36 PM by 81911,106.0,4781.0,gadgets and gaming,2012-09-14 20:36:00, 81911
36,Wtf happened to my pass code,JGM Tools,09-10-2012 09:07 PM by JGM Tools,1.0,564.0,gadgets and gaming,2012-09-10 21:07:00, JGM Tools
37,Porsche Cup Car Tournament Score Thread,jenk12m,09-09-2012 12:30 AM by jenk12m,82.0,3754.0,gadgets and gaming,2012-09-09 00:30:00, jenk12m
38,"Creative ideas for spare Vizio 15"" HDTV?",Moving Chicane,08-30-2012 11:20 AM by Moving Chicane,8.0,748.0,gadgets and gaming,2012-08-30 11:20:00, Moving Chicane
39,"Klipsch S4, S4i and S4a Version II - Now In Stock!",SoundEarphones,08-28-2012 01:13 PM by SoundEarphones,0.0,610.0,gadgets and gaming,2012-08-28 13:13:00, SoundEarphones
40,Home Theater and Automation Picture Thread,Wheeler,08-28-2012 03:53 AM by Wheeler,23.0,4312.0,gadgets and gaming,2012-08-28 03:53:00, Wheeler
41,Remember these? Old school WWF.,BDSK,08-16-2012 01:14 PM by BDSK,3.0,841.0,gadgets and gaming,2012-08-16 13:14:00, BDSK
42,Chris Weidman - UFC Fighter's Custom Beats Headphones,bdeitemeyer,07-27-2012 01:57 AM by bdeitemeyer,2.0,2398.0,gadgets and gaming,2012-07-27 01:57:00, bdeitemeyer
43,Control4 experiences or recommendations?,DEEPBLUE,07-23-2012 07:26 PM by DEEPBLUE,28.0,3986.0,gadgets and gaming,2012-07-23 19:26:00, DEEPBLUE
44,Official Team Speed Forza Motorsports 3 Tournament,kalifornicationx,10-19-2016 05:28 AM by kalifornicationx,88.0,13838.0,gadgets and gaming,2016-10-19 05:28:00, kalifornicationx
45,"Teamspeed To Go. Download the Teamspeed Mobile app for your iPhone, iPad, or Droid!",TEFF,03-14-2012 12:12 PM by TEFF,12.0,11496.0,gadgets and gaming,2012-03-14 12:12:00, TEFF
46,AKG K490 & K495 Noise Canceling Headphones - Now In Stock,SoundEarphones,07-16-2012 04:07 PM by SoundEarphones,0.0,1026.0,gadgets and gaming,2012-07-16 16:07:00, SoundEarphones
47,Diablo III,CrazyRuskie,06-18-2012 04:58 PM by CrazyRuskie,71.0,4208.0,gadgets and gaming,2012-06-18 16:58:00, CrazyRuskie
48,Made in China built in GE microwave dead,Zorro,06-18-2012 11:03 AM by Zorro,9.0,1648.0,gadgets and gaming,2012-06-18 11:03:00, Zorro
49,Made a video of the home simulator,jmusser3r,06-18-2012 02:31 AM by jmusser3r,7.0,774.0,gadgets and gaming,2012-06-18 02:31:00, jmusser3r
50,Help me choose a receiver,Pinned,06-16-2012 01:16 AM by Pinned,6.0,751.0,gadgets and gaming,2012-06-16 01:16:00, Pinned
51,Sennheiser HD700 Headphones - Now In Stock at SoundEarphones!,SoundEarphones,06-08-2012 11:54 AM by SoundEarphones,0.0,691.0,gadgets and gaming,2012-06-08 11:54:00, SoundEarphones
52,Sennheiser MM-550-X Wireless Noise canceling Headphones - Back In Stock!,SoundEarphones,06-06-2012 11:00 AM by SoundEarphones,0.0,936.0,gadgets and gaming,2012-06-06 11:00:00, SoundEarphones
53,GoPro Wi-Fi BacPac finally on sale,MoOriginal,06-06-2012 07:56 AM by MoOriginal,14.0,1792.0,gadgets and gaming,2012-06-06 07:56:00, MoOriginal
54,Windows 8,bbbaazzzz,06-04-2012 02:14 PM by bbbaazzzz,21.0,1925.0,gadgets and gaming,2012-06-04 14:14:00, bbbaazzzz
55,Looking for new smartphone,stuka,06-04-2012 12:17 PM by stuka,12.0,2095.0,gadgets and gaming,2012-06-04 12:17:00, stuka
56,Introducing the Leap,sk8boy,05-26-2012 02:24 AM by sk8boy,0.0,720.0,gadgets and gaming,2012-05-26 02:24:00, sk8boy
57,Any Audiophiles here?,mannnu81,05-24-2012 06:17 PM by mannnu81,73.0,8464.0,gadgets and gaming,2012-05-24 18:17:00, mannnu81
58,F4 Radical Tournament Thread,jenk12m,05-22-2012 01:29 PM by jenk12m,60.0,2897.0,gadgets and gaming,2012-05-22 13:29:00, jenk12m
59,HTC One X from ATT is crippled,stuka,05-17-2012 12:29 AM by stuka,4.0,776.0,gadgets and gaming,2012-05-17 00:29:00, stuka
60,Diablo 3 Member List - Post up Bnet ID here,sheynk,05-15-2012 05:06 PM by sheynk,4.0,576.0,gadgets and gaming,2012-05-15 17:06:00, sheynk
61,F4 Radical Tournament Score Thread,X2daC,05-12-2012 12:22 PM by X2daC,36.0,1998.0,gadgets and gaming,2012-05-12 12:22:00, X2daC
62,Porsche DLC For Forza 4!!!!,Royal Oak,05-07-2012 01:31 PM by Royal Oak,8.0,913.0,gadgets and gaming,2012-05-07 13:31:00, Royal Oak
63,The Air Quality Egg,GrayTT,04-09-2012 05:33 PM by GrayTT,0.0,816.0,gadgets and gaming,2012-04-09 17:33:00, GrayTT
64,What's the cheapest Home Theater PC I could get?,Track Addict,04-06-2012 10:33 PM by Track Addict,7.0,2068.0,gadgets and gaming,2012-04-06 22:33:00, Track Addict
65,What do you guys think about this TV mount?,CrazyRuskie,04-05-2012 05:32 PM by CrazyRuskie,1.0,988.0,gadgets and gaming,2012-04-05 17:32:00, CrazyRuskie
66,Official Team Speed Forza Motorsports 3 Tournament,kalifornicationx,10-19-2016 05:28 AM by kalifornicationx,88.0,13838.0,gadgets and gaming,2016-10-19 05:28:00, kalifornicationx
67,"Teamspeed To Go. Download the Teamspeed Mobile app for your iPhone, iPad, or Droid!",TEFF,03-14-2012 12:12 PM by TEFF,12.0,11496.0,gadgets and gaming,2012-03-14 12:12:00, TEFF
68,"Can anyone help, lost my microsoft office key. Who can hook me up?",ambleZ06,04-03-2012 10:42 AM by ambleZ06,9.0,822.0,gadgets and gaming,2012-04-03 10:42:00, ambleZ06
69,Music Server that stores CD in original format,Christian,04-03-2012 08:21 AM by Christian,23.0,2644.0,gadgets and gaming,2012-04-03 08:21:00, Christian
70,The Official Modern Warfare 2 Thread,Bonita,04-01-2012 07:18 PM by Bonita,2407.0,80096.0,gadgets and gaming,2012-04-01 19:18:00, Bonita
71,URL Extensions... Yes or No,cstroked,04-01-2012 05:24 PM by cstroked,9.0,771.0,gadgets and gaming,2012-04-01 17:24:00, cstroked
72,"The Official ""Coolest"" Technology Thread",McRae,03-31-2012 11:02 PM by McRae,12.0,1608.0,gadgets and gaming,2012-03-31 23:02:00, McRae
73,The Official Battlefield 3 Thread,STOPPIE,03-30-2012 12:38 PM by STOPPIE,161.0,6809.0,gadgets and gaming,2012-03-30 12:38:00, STOPPIE
74,Laser interceptor testing,Superfly,02-26-2012 02:02 AM by Superfly,1.0,1041.0,gadgets and gaming,2012-02-26 02:02:00, Superfly
75,SR Lifestyle Boutique | Porsche Design P’9981 x Blackberry Smartphone,Marc,02-24-2012 02:06 PM by Marc,5.0,2056.0,gadgets and gaming,2012-02-24 14:06:00, Marc
76,Shure SRH1440 & SRH1840 Headphones - Now In Stock,DchaMD,02-24-2012 01:56 PM by DchaMD,1.0,465.0,gadgets and gaming,2012-02-24 13:56:00, DchaMD
77,Galaxy Nexus,bavmtrwrksftw,02-19-2012 10:07 PM by bavmtrwrksftw,22.0,1408.0,gadgets and gaming,2012-02-19 22:07:00, bavmtrwrksftw
78,Flat Screen Installer - San Fernando Valley - Suggestions?,Moving Chicane,02-19-2012 02:12 PM by Moving Chicane,3.0,536.0,gadgets and gaming,2012-02-19 14:12:00, Moving Chicane
79,EarSonics AMP911 - Now In Stock @ SoundEarphones.com,SoundEarphones,02-13-2012 04:11 PM by SoundEarphones,0.0,577.0,gadgets and gaming,2012-02-13 16:11:00, SoundEarphones
80,Samsung DLP Problem - Fix or Buy New,falb,02-11-2012 01:20 PM by falb,7.0,719.0,gadgets and gaming,2012-02-11 13:20:00, falb
81,HDTV OTA Antenna,stuka,02-06-2012 05:10 PM by stuka,2.0,601.0,gadgets and gaming,2012-02-06 17:10:00, stuka
82,Forza 4 Tournament Score Thread,ljg,02-01-2012 11:55 PM by ljg,24.0,1641.0,gadgets and gaming,2012-02-01 23:55:00, ljg
83,Android users tracked,cream168,01-29-2012 06:06 AM by cream168,6.0,795.0,gadgets and gaming,2012-01-29 06:06:00, cream168
84,Best TV for gaming.,cream168,01-29-2012 05:20 AM by cream168,2.0,816.0,gadgets and gaming,2012-01-29 05:20:00, cream168
85,GoPro HD Camera Accessories?,bonehead,01-27-2012 02:35 PM by bonehead,6.0,450.0,gadgets and gaming,2012-01-27 14:35:00, bonehead
86,Official Team Speed Forza 4 Tournament!!!,jenk12m,01-26-2012 12:08 AM by jenk12m,188.0,7250.0,gadgets and gaming,2012-01-26 00:08:00, jenk12m
87,Looking for a new navi touch screen display w/USB port,cream168,01-25-2012 12:52 PM by cream168,0.0,460.0,gadgets and gaming,2012-01-25 12:52:00, cream168
88,Official Team Speed Forza Motorsports 3 Tournament,kalifornicationx,10-19-2016 05:28 AM by kalifornicationx,88.0,13838.0,gadgets and gaming,2016-10-19 05:28:00, kalifornicationx
89,"Teamspeed To Go. Download the Teamspeed Mobile app for your iPhone, iPad, or Droid!",TEFF,03-14-2012 12:12 PM by TEFF,12.0,11496.0,gadgets and gaming,2012-03-14 12:12:00, TEFF
90,"Battery powered WiFi cam, it can't be this exotic",stuka,01-19-2012 07:58 PM by stuka,2.0,1614.0,gadgets and gaming,2012-01-19 19:58:00, stuka
91,Sennheiser RS 220 Wireless & HD 700 Headphones - Now Available to order!,SoundEarphones,01-19-2012 02:50 PM by SoundEarphones,0.0,796.0,gadgets and gaming,2012-01-19 14:50:00, SoundEarphones
92,new trailer for 'Street Fighter X Tekken',sk8boy,01-18-2012 01:09 AM by sk8boy,0.0,421.0,gadgets and gaming,2012-01-18 01:09:00, sk8boy
93,Official Team Speed Forza Motorsports 3 Tournament,kalifornicationx,10-19-2016 05:28 AM by kalifornicationx,88.0,13838.0,gadgets and gaming,2016-10-19 05:28:00, kalifornicationx
94,"Teamspeed To Go. Download the Teamspeed Mobile app for your iPhone, iPad, or Droid!",TEFF,03-14-2012 12:12 PM by TEFF,12.0,11496.0,gadgets and gaming,2012-03-14 12:12:00, TEFF
95,GTA V Crew,King Hill,06-04-2019 07:24 AM by King Hill,16.0,4666.0,gadgets and gaming,2019-06-04 07:24:00, King Hill
96,Hitman Absolution,watchheights,08-12-2017 06:31 AM by watchheights,4.0,6910.0,gadgets and gaming,2017-08-12 06:31:00, watchheights
97,Best Electric Razor?,RodneyOstby,02-09-2017 06:10 AM by RodneyOstby,16.0,4039.0,gadgets and gaming,2017-02-09 06:10:00, RodneyOst
98,SEGA 'Motorsports Manager' (2016 PC) Review,TeamSpeed Editor,12-20-2016 05:55 PM by TeamSpeed Editor,0.0,1249.0,gadgets and gaming,2016-12-20 17:55:00, TeamSpeed Editor
99,'F1 2016' Review: The Fullest F1 Experience Yet,TeamSpeed Editor,09-21-2016 02:36 PM by TeamSpeed Editor,0.0,1457.0,gadgets and gaming,2016-09-21 14:36:00, TeamSpeed Editor
100,Porsche Expansion Comes to Forza Motorsport 6,TeamSpeed Editor,03-07-2016 05:04 PM by TeamSpeed Editor,0.0,1732.0,gadgets and gaming,2016-03-07 17:04:00, TeamSpeed Editor
101,Forza 6 Gets New Car Pack and We Have One to Give Away!,ozz7240,11-05-2015 01:17 PM by ozz7240,10.0,3472.0,gadgets and gaming,2015-11-05 13:17:00, ozz7240
102,"iPhone 6plus, HTC M9, Apple MacBook pro, Samsung S6, Nikon D800E and more electronics",tbilal294,04-12-2015 04:44 AM by tbilal294,0.0,2332.0,gadgets and gaming,2015-04-12 04:44:00, tbilal294
103,Halo 4 - Who Else Can't Wait??,tempodicorrere,07-22-2014 12:43 PM by tempodicorrere,15.0,4648.0,gadgets and gaming,2014-07-22 12:43:00, tempodicorrere
104,thoughts,joshg120,04-14-2014 08:11 PM by joshg120,4.0,1572.0,gadgets and gaming,2014-04-14 20:11:00, joshg120
105,Headphone vendors on the forum?,Hot Shot,01-18-2014 08:59 PM by Hot Shot,5.0,2109.0,gadgets and gaming,2014-01-18 20:59:00, Hot Shot
106,Worth Sharing: Forza 5 Filmspeed,Mixtape,09-24-2013 03:39 PM by Mixtape,2.0,1851.0,gadgets and gaming,2013-09-24 15:39:00, Mixtape
107,GoPro Super Slashed Pricing,[email protected],09-03-2013 09:23 PM by [email protected],0.0,1507.0,gadgets and gaming,2013-09-03 21:23:00, [email protected]
108,Gta v,Zambrano,07-18-2013 12:46 AM by Zambrano,8.0,2268.0,gadgets and gaming,2013-07-18 00:46:00, Zambrano
109,For those who ride a bicycle :),johan,06-11-2013 02:42 PM by johan,0.0,2111.0,gadgets and gaming,2013-06-11 14:42:00, johan
110,The Official Gran Turismo 5 Thread,Dyna,05-23-2013 06:42 AM by Dyna,2895.0,189455.0,gadgets and gaming,2013-05-23 06:42:00, Dyna
111,Sennheiser IE 800 Earphones - Now Shipping!,SoundEarphones,05-11-2013 01:00 AM by SoundEarphones,0.0,2593.0,gadgets and gaming,2013-05-11 01:00:00, SoundEarphones
112,Forza 4,Dyna,04-30-2013 04:49 PM by Dyna,1859.0,77699.0,gadgets and gaming,2013-04-30 16:49:00, Dyna
113,Borderlands,QYKSLVR,02-15-2013 05:01 AM by QYKSLVR,1.0,1487.0,gadgets and gaming,2013-02-15 05:01:00, QYKSLVR
114,"Guys, I need help setting up the best driving simulator",ThunderRolls,01-06-2013 07:32 PM by ThunderRolls,5.0,4905.0,gadgets and gaming,2013-01-06 19:32:00, ThunderRolls
115,Official Team Speed Forza Motorsports 3 Tournament,kalifornicationx,10-19-2016 05:28 AM by kalifornicationx,88.0,13838.0,gadgets and gaming,2016-10-19 05:28:00, kalifornicationx
116,"Teamspeed To Go. Download the Teamspeed Mobile app for your iPhone, iPad, or Droid!",TEFF,03-14-2012 12:12 PM by TEFF,12.0,11496.0,gadgets and gaming,2012-03-14 12:12:00, TEFF
117,B Class Tournament Score Thread,Bonita,11-22-2012 04:21 AM by Bonita,14.0,2470.0,gadgets and gaming,2012-11-22 04:21:00, Bonita
118,Teamspeed B Class Tournament,X2daC,11-21-2012 10:47 PM by X2daC,99.0,6350.0,gadgets and gaming,2012-11-21 22:47:00, X2daC
119,EMVY Iphone 4 or 4S Battery Case with Built in stand.,TheStigSC,11-20-2012 12:25 PM by TheStigSC,46.0,5515.0,gadgets and gaming,2012-11-20 12:25:00, TheStigSC
120,Mass Effect 3,TheStigSC,11-20-2012 12:18 PM by TheStigSC,6.0,1089.0,gadgets and gaming,2012-11-20 12:18:00, TheStigSC
121,Free Gift Card with a Sennheiser Headphone Purchase,SoundEarphones,11-14-2012 06:06 PM by SoundEarphones,0.0,844.0,gadgets and gaming,2012-11-14 18:06:00, SoundEarphones
122,Forza Horizon,X2daC,11-02-2012 01:54 PM by X2daC,41.0,3916.0,gadgets and gaming,2012-11-02 13:54:00, X2daC
123,The Official Modern Warfare 3 Thread,TheStigSC,11-01-2012 12:27 PM by TheStigSC,540.0,22038.0,gadgets and gaming,2012-11-01 12:27:00, TheStigSC
124,AKG K3003i - Back in stock,SoundEarphones,09-24-2012 11:52 AM by SoundEarphones,0.0,1172.0,gadgets and gaming,2012-09-24 11:52:00, SoundEarphones
125,Denon Headphones & Earphones - Now Available @ SoundEarphones.com,SoundEarphones,09-20-2012 03:01 PM by SoundEarphones,0.0,687.0,gadgets and gaming,2012-09-20 15:01:00, SoundEarphones
126,!! Need an audiophiles help !!,adamls2,09-19-2012 03:38 AM by adamls2,0.0,649.0,gadgets and gaming,2012-09-19 03:38:00, adamls2
127,Wadia 171i idock,SoundEarphones,09-15-2012 10:31 AM by SoundEarphones,1.0,878.0,gadgets and gaming,2012-09-15 10:31:00, SoundEarphones
128,Teamspeed Cup Car Tournament,81911,09-14-2012 08:36 PM by 81911,106.0,4781.0,gadgets and gaming,2012-09-14 20:36:00, 81911
129,Wtf happened to my pass code,JGM Tools,09-10-2012 09:07 PM by JGM Tools,1.0,564.0,gadgets and gaming,2012-09-10 21:07:00, JGM Tools
130,Porsche Cup Car Tournament Score Thread,jenk12m,09-09-2012 12:30 AM by jenk12m,82.0,3754.0,gadgets and gaming,2012-09-09 00:30:00, jenk12m
131,"Creative ideas for spare Vizio 15"" HDTV?",Moving Chicane,08-30-2012 11:20 AM by Moving Chicane,8.0,748.0,gadgets and gaming,2012-08-30 11:20:00, Moving Chicane
132,"Klipsch S4, S4i and S4a Version II - Now In Stock!",SoundEarphones,08-28-2012 01:13 PM by SoundEarphones,0.0,610.0,gadgets and gaming,2012-08-28 13:13:00, SoundEarphones
133,Home Theater and Automation Picture Thread,Wheeler,08-28-2012 03:53 AM by Wheeler,23.0,4312.0,gadgets and gaming,2012-08-28 03:53:00, Wheeler
134,Remember these? Old school WWF.,BDSK,08-16-2012 01:14 PM by BDSK,3.0,841.0,gadgets and gaming,2012-08-16 13:14:00, BDSK
135,Chris Weidman - UFC Fighter's Custom Beats Headphones,bdeitemeyer,07-27-2012 01:57 AM by bdeitemeyer,2.0,2398.0,gadgets and gaming,2012-07-27 01:57:00, bdeitemeyer
136,Control4 experiences or recommendations?,DEEPBLUE,07-23-2012 07:26 PM by DEEPBLUE,28.0,3986.0,gadgets and gaming,2012-07-23 19:26:00, DEEPBLUE
137,Official Team Speed Forza Motorsports 3 Tournament,kalifornicationx,10-19-2016 05:28 AM by kalifornicationx,88.0,13838.0,gadgets and gaming,2016-10-19 05:28:00, kalifornicationx
138,"Teamspeed To Go. Download the Teamspeed Mobile app for your iPhone, iPad, or Droid!",TEFF,03-14-2012 12:12 PM by TEFF,12.0,11496.0,gadgets and gaming,2012-03-14 12:12:00, TEFF
139,AKG K490 & K495 Noise Canceling Headphones - Now In Stock,SoundEarphones,07-16-2012 04:07 PM by SoundEarphones,0.0,1026.0,gadgets and gaming,2012-07-16 16:07:00, SoundEarphones
140,Diablo III,CrazyRuskie,06-18-2012 04:58 PM by CrazyRuskie,71.0,4208.0,gadgets and gaming,2012-06-18 16:58:00, CrazyRuskie
141,Made in China built in GE microwave dead,Zorro,06-18-2012 11:03 AM by Zorro,9.0,1648.0,gadgets and gaming,2012-06-18 11:03:00, Zorro
142,Made a video of the home simulator,jmusser3r,06-18-2012 02:31 AM by jmusser3r,7.0,774.0,gadgets and gaming,2012-06-18 02:31:00, jmusser3r
143,Help me choose a receiver,Pinned,06-16-2012 01:16 AM by Pinned,6.0,751.0,gadgets and gaming,2012-06-16 01:16:00, Pinned
144,Sennheiser HD700 Headphones - Now In Stock at SoundEarphones!,SoundEarphones,06-08-2012 11:54 AM by SoundEarphones,0.0,691.0,gadgets and gaming,2012-06-08 11:54:00, SoundEarphones
145,Sennheiser MM-550-X Wireless Noise canceling Headphones - Back In Stock!,SoundEarphones,06-06-2012 11:00 AM by SoundEarphones,0.0,936.0,gadgets and gaming,2012-06-06 11:00:00, SoundEarphones
146,GoPro Wi-Fi BacPac finally on sale,MoOriginal,06-06-2012 07:56 AM by MoOriginal,14.0,1792.0,gadgets and gaming,2012-06-06 07:56:00, MoOriginal
147,Windows 8,bbbaazzzz,06-04-2012 02:14 PM by bbbaazzzz,21.0,1925.0,gadgets and gaming,2012-06-04 14:14:00, bbbaazzzz
148,Looking for new smartphone,stuka,06-04-2012 12:17 PM by stuka,12.0,2095.0,gadgets and gaming,2012-06-04 12:17:00, stuka
149,Introducing the Leap,sk8boy,05-26-2012 02:24 AM by sk8boy,0.0,720.0,gadgets and gaming,2012-05-26 02:24:00, sk8boy
150,Any Audiophiles here?,mannnu81,05-24-2012 06:17 PM by mannnu81,73.0,8464.0,gadgets and gaming,2012-05-24 18:17:00, mannnu81
151,F4 Radical Tournament Thread,jenk12m,05-22-2012 01:29 PM by jenk12m,60.0,2897.0,gadgets and gaming,2012-05-22 13:29:00, jenk12m
152,HTC One X from ATT is crippled,stuka,05-17-2012 12:29 AM by stuka,4.0,776.0,gadgets and gaming,2012-05-17 00:29:00, stuka
153,Diablo 3 Member List - Post up Bnet ID here,sheynk,05-15-2012 05:06 PM by sheynk,4.0,576.0,gadgets and gaming,2012-05-15 17:06:00, sheynk
154,F4 Radical Tournament Score Thread,X2daC,05-12-2012 12:22 PM by X2daC,36.0,1998.0,gadgets and gaming,2012-05-12 12:22:00, X2daC
155,Porsche DLC For Forza 4!!!!,Royal Oak,05-07-2012 01:31 PM by Royal Oak,8.0,913.0,gadgets and gaming,2012-05-07 13:31:00, Royal Oak
156,The Air Quality Egg,GrayTT,04-09-2012 05:33 PM by GrayTT,0.0,816.0,gadgets and gaming,2012-04-09 17:33:00, GrayTT
157,What's the cheapest Home Theater PC I could get?,Track Addict,04-06-2012 10:33 PM by Track Addict,7.0,2068.0,gadgets and gaming,2012-04-06 22:33:00, Track Addict
158,What do you guys think about this TV mount?,CrazyRuskie,04-05-2012 05:32 PM by CrazyRuskie,1.0,988.0,gadgets and gaming,2012-04-05 17:32:00, CrazyRuskie
159,Official Team Speed Forza Motorsports 3 Tournament,kalifornicationx,10-19-2016 05:28 AM by kalifornicationx,88.0,13838.0,gadgets and gaming,2016-10-19 05:28:00, kalifornicationx
160,"Teamspeed To Go. Download the Teamspeed Mobile app for your iPhone, iPad, or Droid!",TEFF,03-14-2012 12:12 PM by TEFF,12.0,11496.0,gadgets and gaming,2012-03-14 12:12:00, TEFF
161,"Can anyone help, lost my microsoft office key. Who can hook me up?",ambleZ06,04-03-2012 10:42 AM by ambleZ06,9.0,822.0,gadgets and gaming,2012-04-03 10:42:00, ambleZ06
162,Music Server that stores CD in original format,Christian,04-03-2012 08:21 AM by Christian,23.0,2644.0,gadgets and gaming,2012-04-03 08:21:00, Christian
163,The Official Modern Warfare 2 Thread,Bonita,04-01-2012 07:18 PM by Bonita,2407.0,80096.0,gadgets and gaming,2012-04-01 19:18:00, Bonita
164,URL Extensions... Yes or No,cstroked,04-01-2012 05:24 PM by cstroked,9.0,771.0,gadgets and gaming,2012-04-01 17:24:00, cstroked
165,"The Official ""Coolest"" Technology Thread",McRae,03-31-2012 11:02 PM by McRae,12.0,1608.0,gadgets and gaming,2012-03-31 23:02:00, McRae
166,The Official Battlefield 3 Thread,STOPPIE,03-30-2012 12:38 PM by STOPPIE,161.0,6809.0,gadgets and gaming,2012-03-30 12:38:00, STOPPIE
167,Laser interceptor testing,Superfly,02-26-2012 02:02 AM by Superfly,1.0,1041.0,gadgets and gaming,2012-02-26 02:02:00, Superfly
168,SR Lifestyle Boutique | Porsche Design P’9981 x Blackberry Smartphone,Marc,02-24-2012 02:06 PM by Marc,5.0,2056.0,gadgets and gaming,2012-02-24 14:06:00, Marc
169,Shure SRH1440 & SRH1840 Headphones - Now In Stock,DchaMD,02-24-2012 01:56 PM by DchaMD,1.0,465.0,gadgets and gaming,2012-02-24 13:56:00, DchaMD
170,Galaxy Nexus,bavmtrwrksftw,02-19-2012 10:07 PM by bavmtrwrksftw,22.0,1408.0,gadgets and gaming,2012-02-19 22:07:00, bavmtrwrksftw
171,Flat Screen Installer - San Fernando Valley - Suggestions?,Moving Chicane,02-19-2012 02:12 PM by Moving Chicane,3.0,536.0,gadgets and gaming,2012-02-19 14:12:00, Moving Chicane
172,EarSonics AMP911 - Now In Stock @ SoundEarphones.com,SoundEarphones,02-13-2012 04:11 PM by SoundEarphones,0.0,577.0,gadgets and gaming,2012-02-13 16:11:00, SoundEarphones
173,Samsung DLP Problem - Fix or Buy New,falb,02-11-2012 01:20 PM by falb,7.0,719.0,gadgets and gaming,2012-02-11 13:20:00, falb
174,HDTV OTA Antenna,stuka,02-06-2012 05:10 PM by stuka,2.0,601.0,gadgets and gaming,2012-02-06 17:10:00, stuka
175,Forza 4 Tournament Score Thread,ljg,02-01-2012 11:55 PM by ljg,24.0,1641.0,gadgets and gaming,2012-02-01 23:55:00, ljg
176,Android users tracked,cream168,01-29-2012 06:06 AM by cream168,6.0,795.0,gadgets and gaming,2012-01-29 06:06:00, cream168
177,Best TV for gaming.,cream168,01-29-2012 05:20 AM by cream168,2.0,816.0,gadgets and gaming,2012-01-29 05:20:00, cream168
178,GoPro HD Camera Accessories?,bonehead,01-27-2012 02:35 PM by bonehead,6.0,450.0,gadgets and gaming,2012-01-27 14:35:00, bonehead
179,Official Team Speed Forza 4 Tournament!!!,jenk12m,01-26-2012 12:08 AM by jenk12m,188.0,7250.0,gadgets and gaming,2012-01-26 00:08:00, jenk12m
180,Looking for a new navi touch screen display w/USB port,cream168,01-25-2012 12:52 PM by cream168,0.0,460.0,gadgets and gaming,2012-01-25 12:52:00, cream168
181,Official Team Speed Forza Motorsports 3 Tournament,kalifornicationx,10-19-2016 05:28 AM by kalifornicationx,88.0,13838.0,gadgets and gaming,2016-10-19 05:28:00, kalifornicationx
182,"Teamspeed To Go. Download the Teamspeed Mobile app for your iPhone, iPad, or Droid!",TEFF,03-14-2012 12:12 PM by TEFF,12.0,11496.0,gadgets and gaming,2012-03-14 12:12:00, TEFF
183,"Battery powered WiFi cam, it can't be this exotic",stuka,01-19-2012 07:58 PM by stuka,2.0,1614.0,gadgets and gaming,2012-01-19 19:58:00, stuka
184,Sennheiser RS 220 Wireless & HD 700 Headphones - Now Available to order!,SoundEarphones,01-19-2012 02:50 PM by SoundEarphones,0.0,796.0,gadgets and gaming,2012-01-19 14:50:00, SoundEarphones
185,new trailer for 'Street Fighter X Tekken',sk8boy,01-18-2012 01:09 AM by sk8boy,0.0,421.0,gadgets and gaming,2012-01-18 01:09:00, sk8boy
186,Sexy Booth Babes...,Sexy Booth Babes...,,,,gadgets and gaming,,
187,Walkie-Talkies,bonehead,01-07-2012 11:23 PM by bonehead,6.0,996.0,gadgets and gaming,2012-01-07 23:23:00, bonehead
188,SR Lifestyle Boutique | Mobiado Grand Touch,SR Auto Group,01-05-2012 04:58 PM by SR Auto Group,0.0,1544.0,gadgets and gaming,2012-01-05 16:58:00, SR Auto Group
189,Driver San Francisco,Neil Switzer,01-03-2012 06:18 PM by Neil Switzer,9.0,863.0,gadgets and gaming,2012-01-03 18:18:00, Neil Switzer
190,$1K HDTV Recommendation,M-Individual,01-02-2012 06:50 PM by M-Individual,11.0,1469.0,gadgets and gaming,2012-01-02 18:50:00, M-Individual
191,New XBOX Update,GuessWho,12-22-2011 05:46 PM by GuessWho,10.0,992.0,gadgets and gaming,2011-12-22 17:46:00, GuessWho
192,Gadget Deals of the Day,JuiceBox,12-22-2011 02:38 AM by JuiceBox,78.0,7367.0,gadgets and gaming,2011-12-22 02:38:00, JuiceBox
193,SR Lifestyle Boutique | Mobiado 712 Stealth Limited Edition,SR Auto Group,12-19-2011 07:14 PM by SR Auto Group,0.0,662.0,gadgets and gaming,2011-12-19 19:14:00, SR Auto Group
194,Tdu 2 club,911Boy,12-18-2011 08:07 PM by 911Boy,2.0,544.0,gadgets and gaming,2011-12-18 20:07:00, 911Boy
195,Anyone want to play forza 4 tonight?,jenk12m,12-16-2011 01:21 AM by jenk12m,1.0,711.0,gadgets and gaming,2011-12-16 01:21:00, jenk12m
196,Klipsch Reference Image Series - Now In Stock!,SoundEarphones,12-13-2011 04:00 PM by SoundEarphones,0.0,458.0,gadgets and gaming,2011-12-13 16:00:00, SoundEarphones
197,How the heck do I learn java,zbaums,12-12-2011 07:42 PM by zbaums,11.0,1243.0,gadgets and gaming,2011-12-12 19:42:00, zbaums
198,PS3 Id's,slord,12-10-2011 01:07 AM by slord,86.0,4569.0,gadgets and gaming,2011-12-10 01:07:00, slord
199,Star Wars: The Old Republic,All We'll Drive,12-08-2011 08:13 AM by All We'll Drive,3.0,533.0,gadgets and gaming,2011-12-08 08:13:00, All We'll Drive
200,Urine-controlled video games installed in London bar,sk8boy,11-29-2011 12:06 AM by sk8boy,0.0,462.0,gadgets and gaming,2011-11-29 00:06:00, sk8boy
201,The Official Black Friday Thread,Pinned,11-27-2011 12:01 PM by Pinned,55.0,2666.0,gadgets and gaming,2011-11-27 12:01:00, Pinned
202,"AT&T users, htc vivid vs samsung galaxy skyrocket",vdubpower,11-24-2011 04:57 AM by vdubpower,11.0,1241.0,gadgets and gaming,2011-11-24 04:57:00, vdubpower
203,Official Team Speed Forza Motorsports 3 Tournament,kalifornicationx,10-19-2016 05:28 AM by kalifornicationx,88.0,13838.0,gadgets and gaming,2016-10-19 05:28:00, kalifornicationx
204,"Teamspeed To Go. Download the Teamspeed Mobile app for your iPhone, iPad, or Droid!",TEFF,03-14-2012 12:12 PM by TEFF,12.0,11496.0,gadgets and gaming,2012-03-14 12:12:00, TEFF
205,Tablet?,sheynk,11-22-2011 08:01 PM by sheynk,6.0,507.0,gadgets and gaming,2011-11-22 20:01:00, sheynk
206,Wyred 4 Sound modified Sonos Zone Player 90,DJ,11-22-2011 05:27 PM by DJ,2.0,1793.0,gadgets and gaming,2011-11-22 17:27:00, DJ
207,UP by Jawbone,djantlive,11-19-2011 11:33 AM by djantlive,11.0,815.0,gadgets and gaming,2011-11-19 11:33:00, djantlive
208,Saints row: The Third Thread,911Boy,11-18-2011 10:59 PM by 911Boy,7.0,617.0,gadgets and gaming,2011-11-18 22:59:00, 911Boy
209,Saint's Row and Need for Speed: The Run available today,sk8boy,11-17-2011 11:32 AM by sk8boy,1.0,482.0,gadgets and gaming,2011-11-17 11:32:00, sk8boy
210,Limited Edition Lou Reed Klipsch X10i Earphones - Available @ SoundEarphones.com,O2Supply,11-16-2011 01:06 PM by O2Supply,2.0,838.0,gadgets and gaming,2011-11-16 13:06:00, O2Supply
211,Sennheiser HD 449 & HD 229 Headphones - Now Available  @ SoundEarphones.com,SoundEarphones,11-15-2011 03:37 PM by SoundEarphones,0.0,1902.0,gadgets and gaming,2011-11-15 15:37:00, SoundEarphones
212,Should I consider a 10.1 over the ipad2?,65°V12,11-12-2011 06:28 PM by 65°V12,26.0,1279.0,gadgets and gaming,2011-11-12 18:28:00, 65°V12
213,Steam Having A Nice Sale On Two Great Racing Titles,65°V12,11-11-2011 12:53 AM by 65°V12,7.0,529.0,gadgets and gaming,2011-11-11 00:53:00, 65°V12
214,Have a DLP? Replace the lamp!,Barrister,11-10-2011 09:16 PM by Barrister,9.0,802.0,gadgets and gaming,2011-11-10 21:16:00, Barrister
215,The Official Call of Duty: Black Ops Thread,Detailer,11-10-2011 08:59 PM by Detailer,350.0,13301.0,gadgets and gaming,2011-11-10 20:59:00, Detailer
216,Is this in our very near future?,STOPPIE,11-09-2011 01:23 PM by STOPPIE,4.0,675.0,gadgets and gaming,2011-11-09 13:23:00, STOPPIE
217,Camcorder vs. DSLR?,GrayTT,10-31-2011 08:09 AM by GrayTT,1.0,545.0,gadgets and gaming,2011-10-31 08:09:00, GrayTT
218,Gta v,gmaccormack,10-30-2011 12:01 AM by gmaccormack,1.0,446.0,gadgets and gaming,2011-10-30 00:01:00, gmaccormack
219,Question for all the Windows/PC/Exchange/Outlook gurus....,bmoores,10-26-2011 12:01 PM by bmoores,2.0,493.0,gadgets and gaming,2011-10-26 12:01:00, bmoores
220,Forza 4 Tournament? Interested?,BigE,10-26-2011 12:53 AM by BigE,13.0,826.0,gadgets and gaming,2011-10-26 00:53:00, BigE
221,Wireless Routers,h20skier,10-25-2011 11:19 AM by h20skier,19.0,1057.0,gadgets and gaming,2011-10-25 11:19:00, h20skier
222,Unlock BF3 Early!,Winchm60,10-24-2011 08:54 PM by Winchm60,8.0,1181.0,gadgets and gaming,2011-10-24 20:54:00, Winchm60
223,Ultimate Battlefield 3 Simulator,TTM0TION,10-20-2011 11:02 PM by TTM0TION,10.0,786.0,gadgets and gaming,2011-10-20 23:02:00, TTM0TION
224,PS3 firmware help!,strebo,10-19-2011 02:41 PM by strebo,2.0,440.0,gadgets and gaming,2011-10-19 14:41:00, strebo
225,Official Team Speed Forza Motorsports 3 Tournament,kalifornicationx,10-19-2016 05:28 AM by kalifornicationx,88.0,13838.0,gadgets and gaming,2016-10-19 05:28:00, kalifornicationx
226,"Teamspeed To Go. Download the Teamspeed Mobile app for your iPhone, iPad, or Droid!",TEFF,03-14-2012 12:12 PM by TEFF,12.0,11496.0,gadgets and gaming,2012-03-14 12:12:00, TEFF
227,Buy Beyerdynamic T 5 P or T 50 P and get a free pair of earphones!,SoundEarphones,10-17-2011 05:20 PM by SoundEarphones,0.0,698.0,gadgets and gaming,2011-10-17 17:20:00, SoundEarphones
228,Noise Canceling Headphones,SoundEarphones,10-15-2011 11:50 PM by SoundEarphones,27.0,1617.0,gadgets and gaming,2011-10-15 23:50:00, SoundEarphones
229,R/C and other hobbies,Cooch,10-13-2011 12:01 AM by Cooch,56.0,6601.0,gadgets and gaming,2011-10-13 00:01:00, Cooch
230,Switched On: Multi-room music's rocket ride,strebo,10-11-2011 09:36 AM by strebo,2.0,664.0,gadgets and gaming,2011-10-11 09:36:00, strebo
231,Anyone get/playing Rage?,65°V12,10-07-2011 10:07 PM by 65°V12,8.0,481.0,gadgets and gaming,2011-10-07 22:07:00, 65°V12
232,"The 70"" TV that I will be getting",stuka,10-06-2011 02:39 AM by stuka,40.0,2187.0,gadgets and gaming,2011-10-06 02:39:00, stuka
233,cool PS3 commercial,sk8boy,10-06-2011 12:48 AM by sk8boy,0.0,453.0,gadgets and gaming,2011-10-06 00:48:00, sk8boy
234,The Official F1 2011 Thread,chapsbk,10-01-2011 09:19 AM by chapsbk,10.0,1076.0,gadgets and gaming,2011-10-01 09:19:00, chapsbk
235,PS3 All Region Hack,stuka,09-27-2011 01:24 PM by stuka,1.0,1894.0,gadgets and gaming,2011-09-27 13:24:00, stuka
236,Trials HD,All We'll Drive,09-26-2011 05:58 PM by All We'll Drive,3.0,478.0,gadgets and gaming,2011-09-26 17:58:00, All We'll Drive
237,Red Dead Redemption,All We'll Drive,09-21-2011 09:13 PM by All We'll Drive,4.0,506.0,gadgets and gaming,2011-09-21 21:13:00, All We'll Drive
238,PS3 Slim rocks,Chris from Cali,09-18-2011 12:57 PM by Chris from Cali,1.0,515.0,gadgets and gaming,2011-09-18 12:57:00, Chris from Cali
239,Router/proxy config question ...,Zorro,09-13-2011 07:04 PM by Zorro,0.0,553.0,gadgets and gaming,2011-09-13 19:04:00, Zorro
240,Buy It Today...Enjoy It Tomorrow!,SoundEarphones,09-07-2011 02:59 PM by SoundEarphones,0.0,544.0,gadgets and gaming,2011-09-07 14:59:00, SoundEarphones
241,15% off any all Tom Tom GPS systems,DJ,09-03-2011 11:12 AM by DJ,0.0,520.0,gadgets and gaming,2011-09-03 11:12:00, DJ
242,HD is dead on GF's laptop,Craddosk,08-31-2011 08:38 PM by Craddosk,13.0,950.0,gadgets and gaming,2011-08-31 20:38:00, Craddosk
243,Need For Speed:The Run - Limited Edition Trailer with new 911S,nrz,08-24-2011 05:53 PM by nrz,14.0,1213.0,gadgets and gaming,2011-08-24 17:53:00, nrz
244,Mobiado Grand Touch & Grand Touch GCB Release @ SR,SR Auto Group,08-23-2011 06:56 PM by SR Auto Group,0.0,1963.0,gadgets and gaming,2011-08-23 18:56:00, SR Auto Group
245,Did the SATA2 3Gbps hack on my Thinkpad T61p,stuka,08-19-2011 08:57 PM by stuka,0.0,1622.0,gadgets and gaming,2011-08-19 20:57:00, stuka
246,HI-FI bookshelf stereo - help!,BuzzedHornet,08-19-2011 06:47 PM by BuzzedHornet,16.0,1340.0,gadgets and gaming,2011-08-19 18:47:00, BuzzedHornet
247,Official Team Speed Forza Motorsports 3 Tournament,kalifornicationx,10-19-2016 05:28 AM by kalifornicationx,88.0,13838.0,gadgets and gaming,2016-10-19 05:28:00, kalifornicationx
248,"Teamspeed To Go. Download the Teamspeed Mobile app for your iPhone, iPad, or Droid!",TEFF,03-14-2012 12:12 PM by TEFF,12.0,11496.0,gadgets and gaming,2012-03-14 12:12:00, TEFF
249,Anyone Play Tiny Tower?,Mini George,07-29-2011 11:59 PM by Mini George,11.0,984.0,gadgets and gaming,2011-07-29 23:59:00, Mini George
250,Battlefield 3 Trailer (MUST see),Mietek23,07-29-2011 10:04 PM by Mietek23,27.0,1574.0,gadgets and gaming,2011-07-29 22:04:00, Mietek23
251,Wordpress help - thumbnail stretching...,sheynk,07-27-2011 12:54 PM by sheynk,2.0,636.0,gadgets and gaming,2011-07-27 12:54:00, sheynk
252,Version 3 of SoundEarphones.com - Now Online,SoundEarphones,07-25-2011 02:44 PM by SoundEarphones,0.0,528.0,gadgets and gaming,2011-07-25 14:44:00, SoundEarphones
253,Beyerdynamic T70 and T7P - Now Available for order,SoundEarphones,07-22-2011 12:21 PM by SoundEarphones,0.0,908.0,gadgets and gaming,2011-07-22 12:21:00, SoundEarphones
254,Official GT5 Photo Thread,QYKSLVR,07-19-2011 05:11 AM by QYKSLVR,31.0,3967.0,gadgets and gaming,2011-07-19 05:11:00, QYKSLVR
255,New hard drive for the MacBook Pro: Part 2,Craigger,07-12-2011 09:02 AM by Craigger,1.0,511.0,gadgets and gaming,2011-07-12 09:02:00, Craigger
256,Sennheiser CXC 700 Active Noise-Canceling Headphones - Now Available,SoundEarphones,07-08-2011 10:54 AM by SoundEarphones,0.0,617.0,gadgets and gaming,2011-07-08 10:54:00, SoundEarphones
257,Is PSN down!?!?!?,TTM0TION,07-05-2011 11:15 PM by TTM0TION,3.0,427.0,gadgets and gaming,2011-07-05 23:15:00, TTM0TION
258,Printer Advice Needed,Chris from Cali,07-05-2011 09:26 PM by Chris from Cali,8.0,587.0,gadgets and gaming,2011-07-05 21:26:00, Chris from Cali
259,SoundEarphones Review: Klipsch S5i RUGGED Earphones,mannnu81,07-05-2011 01:28 PM by mannnu81,2.0,1254.0,gadgets and gaming,2011-07-05 13:28:00, mannnu81
260,DA's for iphone / ipod,BuzzedHornet,07-05-2011 01:05 PM by BuzzedHornet,0.0,411.0,gadgets and gaming,2011-07-05 13:05:00, BuzzedHornet
261,Anyone own a Nintendo 3DS?,65°V12,07-05-2011 12:45 PM by 65°V12,4.0,478.0,gadgets and gaming,2011-07-05 12:45:00, 65°V12
262,SoundEarphones Review: SENNHEISER MM550 Headphones,SoundEarphones,07-05-2011 12:31 PM by SoundEarphones,0.0,801.0,gadgets and gaming,2011-07-05 12:31:00, SoundEarphones
263,SoundEarphones Review: YAMAHA TSX-140 iPod Dock,SoundEarphones,07-05-2011 12:21 PM by SoundEarphones,0.0,2277.0,gadgets and gaming,2011-07-05 12:21:00, SoundEarphones
264,Soundearphones Review: SKULLCANDY HEAVY MEDAL,SoundEarphones,07-05-2011 12:12 PM by SoundEarphones,0.0,15330.0,gadgets and gaming,2011-07-05 12:12:00, SoundEarphones
265,Sharp 70 inch 3D 240hz LED TV,djantlive,07-05-2011 01:30 AM by djantlive,9.0,3360.0,gadgets and gaming,2011-07-05 01:30:00, djantlive
266,Careful who you game with,STOPPIE,06-22-2011 04:31 PM by STOPPIE,2.0,607.0,gadgets and gaming,2011-06-22 16:31:00, STOPPIE
267,Saw this epicly cool item,McRae,06-14-2011 04:33 PM by McRae,6.0,1519.0,gadgets and gaming,2011-06-14 16:33:00, McRae
268,3d Blueray Players,theritz226,06-14-2011 04:17 PM by theritz226,13.0,1069.0,gadgets and gaming,2011-06-14 16:17:00, theritz226
269,Official Team Speed Forza Motorsports 3 Tournament,kalifornicationx,10-19-2016 05:28 AM by kalifornicationx,88.0,13838.0,gadgets and gaming,2016-10-19 05:28:00, kalifornicationx
270,"Teamspeed To Go. Download the Teamspeed Mobile app for your iPhone, iPad, or Droid!",TEFF,03-14-2012 12:12 PM by TEFF,12.0,11496.0,gadgets and gaming,2012-03-14 12:12:00, TEFF
271,Ghost Recon: Future Soldier (for Kinect),Mini George,06-08-2011 03:45 PM by Mini George,4.0,688.0,gadgets and gaming,2011-06-08 15:45:00, Mini George
272,"""Wii U"" - Nintendo’s new videogame console",65°V12,06-08-2011 12:34 AM by 65°V12,1.0,458.0,gadgets and gaming,2011-06-08 00:34:00, 65°V12
273,Looking for feedback on new blog,SamWise,06-07-2011 02:47 PM by SamWise,2.0,526.0,gadgets and gaming,2011-06-07 14:47:00, SamWise
274,Media storage system for home,D.Liu,06-07-2011 02:11 PM by D.Liu,2.0,630.0,gadgets and gaming,2011-06-07 14:11:00, D.Liu
275,The Official E3 2011 Thread,65°V12,06-07-2011 02:40 AM by 65°V12,4.0,793.0,gadgets and gaming,2011-06-07 02:40:00, 65°V12
276,Need a new BBQ grill,45otto,06-04-2011 04:49 PM by 45otto,18.0,1838.0,gadgets and gaming,2011-06-04 16:49:00, 45otto
277,Wireless Router,SoCal,05-31-2011 08:10 AM by SoCal,7.0,689.0,gadgets and gaming,2011-05-31 08:10:00, SoCal
278,Carbon Furniture - by Revozport,Ogaleicrum,05-30-2011 10:42 AM by Ogaleicrum,13.0,2720.0,gadgets and gaming,2011-05-30 10:42:00, Ogaleicrum
279,Got an Audio Question....,Super Six Five,05-29-2011 03:09 AM by Super Six Five,3.0,597.0,gadgets and gaming,2011-05-29 03:09:00, Super Six Five
280,All Ubisoft Games 33% Off On Steam This Week!,Barrister,05-28-2011 03:43 PM by Barrister,18.0,793.0,gadgets and gaming,2011-05-28 15:43:00, Barrister
281,GT5 Carbon Racing Console - By Revozport,Revozport,05-28-2011 12:25 PM by Revozport,3.0,834.0,gadgets and gaming,2011-05-28 12:25:00, Revozport
282,Decent Plasma HDTVs,Ridgback,05-28-2011 08:48 AM by Ridgback,7.0,788.0,gadgets and gaming,2011-05-28 08:48:00, Ridgback
283,PSN Password Recovery Service Down?,diskreet,05-27-2011 10:59 PM by diskreet,3.0,1434.0,gadgets and gaming,2011-05-27 22:59:00, diskreet
284,Blackberry 9900,h20skier,05-22-2011 11:42 PM by h20skier,26.0,1843.0,gadgets and gaming,2011-05-22 23:42:00, h20skier
285,Blu Ray Player that controls all actions,brnsrgn,05-16-2011 09:57 PM by brnsrgn,6.0,739.0,gadgets and gaming,2011-05-16 21:57:00, brnsrgn
286,The Official Battlefield: Bad Company 2 Thread (Multiplayer Demo Out Now!),sinan,05-16-2011 09:12 AM by sinan,101.0,3993.0,gadgets and gaming,2011-05-16 09:12:00, sinan
287,Sony PSN Data Breach Compromises 77 Million User Accounts,GuessWho,05-15-2011 07:03 PM by GuessWho,33.0,2254.0,gadgets and gaming,2011-05-15 19:03:00, GuessWho
288,Palm Pre Plus or iPhone 4?,TeutonicCarFan,05-14-2011 01:45 PM by TeutonicCarFan,2.0,789.0,gadgets and gaming,2011-05-14 13:45:00, TeutonicCarFan
289,Looking for a Def Technologies Mythos 2 in Silver.,BuzzedHornet,05-11-2011 08:48 PM by BuzzedHornet,1.0,622.0,gadgets and gaming,2011-05-11 20:48:00, BuzzedHornet
290,New Medal of Honor game looks AWESOME,Super Six Five,05-11-2011 12:52 AM by Super Six Five,247.0,11616.0,gadgets and gaming,2011-05-11 00:52:00, Super Six Five
291,Official Team Speed Forza Motorsports 3 Tournament,kalifornicationx,10-19-2016 05:28 AM by kalifornicationx,88.0,13838.0,gadgets and gaming,2016-10-19 05:28:00, kalifornicationx
292,"Teamspeed To Go. Download the Teamspeed Mobile app for your iPhone, iPad, or Droid!",TEFF,03-14-2012 12:12 PM by TEFF,12.0,11496.0,gadgets and gaming,2012-03-14 12:12:00, TEFF
293,Shure SRH940 Headphone - Now shipping @ SoundEarphones.com,SoundEarphones,05-05-2011 01:28 PM by SoundEarphones,0.0,595.0,gadgets and gaming,2011-05-05 13:28:00, SoundEarphones
294,"EarSoincs SM1, SM2 v2 & SM3 v2 - Now Available",SoundEarphones,05-04-2011 01:43 PM by SoundEarphones,0.0,1125.0,gadgets and gaming,2011-05-04 13:43:00, SoundEarphones
295,Contour 1080p Wearable Camera - Now Available at SoundEarphones.com,SoundEarphones,04-28-2011 01:46 PM by SoundEarphones,0.0,585.0,gadgets and gaming,2011-04-28 13:46:00, SoundEarphones
296,Mortal kooombaaat!!!,Smoky,04-26-2011 01:33 PM by Smoky,7.0,638.0,gadgets and gaming,2011-04-26 13:33:00, Smoky
297,Tablets,ljg,04-23-2011 03:57 PM by ljg,27.0,2013.0,gadgets and gaming,2011-04-23 15:57:00, ljg
298,AT&T Takeover of T-mobile,STLG,04-19-2011 06:43 PM by STLG,0.0,458.0,gadgets and gaming,2011-04-19 18:43:00, STLG
299,BlackBerry PlayBook review by Engadget,STLG,04-17-2011 02:25 AM by STLG,5.0,723.0,gadgets and gaming,2011-04-17 02:25:00, STLG
300,So what shooter to get?,65°V12,04-17-2011 02:09 AM by 65°V12,16.0,2707.0,gadgets and gaming,2011-04-17 02:09:00, 65°V12
301,EarSonics SM2 and SM3 Sale,STLG,04-14-2011 03:09 PM by STLG,2.0,1842.0,gadgets and gaming,2011-04-14 15:09:00, STLG
302,Apple,slord,04-10-2011 07:29 PM by slord,22.0,2658.0,gadgets and gaming,2011-04-10 19:29:00, slord
303,"Gamers, laptop cooler help",ADV.1 Matt,04-08-2011 01:42 PM by ADV.1 Matt,4.0,802.0,gadgets and gaming,2011-04-08 13:42:00, ADV.1 Matt
304,Just upgraded to Def Tech Mythos STS speakers - which center should I buy? ++ PICS ++,Superfly,04-08-2011 12:59 AM by Superfly,7.0,1530.0,gadgets and gaming,2011-04-08 00:59:00, Superfly
305,Earphones,STLG,04-05-2011 06:18 PM by STLG,12.0,1488.0,gadgets and gaming,2011-04-05 18:18:00, STLG
306,"Does anyone have any of the new Shure earphones (315, 425, 535)?",STLG,03-31-2011 01:15 PM by STLG,5.0,1126.0,gadgets and gaming,2011-03-31 13:15:00, STLG
307,Shure SE215 Earphones - Now Shipping @ SoundEarphones,STLG,03-31-2011 12:01 PM by STLG,3.0,844.0,gadgets and gaming,2011-03-31 12:01:00, STLG
308,Killzone 3,Alex_997TurboRSC,03-31-2011 06:06 AM by Alex_997TurboRSC,10.0,970.0,gadgets and gaming,2011-03-31 06:06:00, Alex_997TurboRSC
309,Help With New Tv,C Money,03-25-2011 05:02 PM by C Money,9.0,2863.0,gadgets and gaming,2011-03-25 17:02:00, C Money
310,Test Drive Unlimited 2,Winchm60,03-25-2011 10:52 AM by Winchm60,30.0,2705.0,gadgets and gaming,2011-03-25 10:52:00, Winchm60
311,iCade...something else for your iPad,sinan,03-23-2011 05:14 AM by sinan,1.0,490.0,gadgets and gaming,2011-03-23 05:14:00, sinan
312,MLB 11: The Show - Comes Out Tomorrow,Barrister,03-07-2011 01:06 AM by Barrister,2.0,640.0,gadgets and gaming,2011-03-07 01:06:00, Barrister
313,Official Team Speed Forza Motorsports 3 Tournament,kalifornicationx,10-19-2016 05:28 AM by kalifornicationx,88.0,13838.0,gadgets and gaming,2016-10-19 05:28:00, kalifornicationx
314,"Teamspeed To Go. Download the Teamspeed Mobile app for your iPhone, iPad, or Droid!",TEFF,03-14-2012 12:12 PM by TEFF,12.0,11496.0,gadgets and gaming,2012-03-14 12:12:00, TEFF
315,Has anyone been playing NFS Hot Pursuit??,65°V12,03-05-2011 06:37 PM by 65°V12,20.0,1654.0,gadgets and gaming,2011-03-05 18:37:00, 65°V12
316,What type of phone do you have?,roccoman,03-04-2011 12:19 PM by roccoman,64.0,4053.0,gadgets and gaming,2011-03-04 12:19:00, roccoman
317,FS: Bunch Of Video Games and South Park Complete DVD Seasons 1-6,Barrister,02-25-2011 08:53 PM by Barrister,3.0,656.0,gadgets and gaming,2011-02-25 20:53:00, Barrister
318,THE PAGANI HUAYRA -- Exclusive to SHIFT 2 Unleashed,Alzilla,02-19-2011 12:53 PM by Alzilla,1.0,552.0,gadgets and gaming,2011-02-19 12:53:00, Alzilla
319,Need an iPod Dock? The new 2011 Yamaha have arrived.,Yonder,02-16-2011 03:46 PM by Yonder,7.0,1568.0,gadgets and gaming,2011-02-16 15:46:00, Yonder
320,Wadia iTransport 171i - Now In Stock,ljg,02-11-2011 04:22 PM by ljg,3.0,1309.0,gadgets and gaming,2011-02-11 16:22:00, ljg
321,Beltronics STI Driver Radar Detector?,C Money,02-10-2011 12:08 PM by C Money,1.0,463.0,gadgets and gaming,2011-02-10 12:08:00, C Money
322,Fan repair on my 5281F Samsung local dimming TV,stuka,02-09-2011 06:16 PM by stuka,0.0,1214.0,gadgets and gaming,2011-02-09 18:16:00, stuka
323,Talk to me about the PDP607CMX 60 inch Plasma,C Money,02-08-2011 07:37 PM by C Money,4.0,529.0,gadgets and gaming,2011-02-08 19:37:00, C Money
324,Official: Battlefield 3,Chris from Cali,02-04-2011 02:39 PM by Chris from Cali,3.0,604.0,gadgets and gaming,2011-02-04 14:39:00, Chris from Cali
325,"Best Buy to announce ""Buy Back"" program during the Superbowl",Barrister,02-03-2011 08:14 PM by Barrister,10.0,1234.0,gadgets and gaming,2011-02-03 20:14:00, Barrister
326,Local dimming LED TV 2011,DchaMD,02-02-2011 11:59 AM by DchaMD,11.0,2531.0,gadgets and gaming,2011-02-02 11:59:00, DchaMD
327,Teamspeed Gaming Review: Killzone 2,Andrew,02-02-2011 11:55 AM by Andrew,16.0,2389.0,gadgets and gaming,2011-02-02 11:55:00, Andrew
328,Ps3 + gt5,Andrew,02-02-2011 11:55 AM by Andrew,13.0,1267.0,gadgets and gaming,2011-02-02 11:55:00, Andrew
329,Looking for I-pod stereo with some punch,djantlive,01-29-2011 11:58 AM by djantlive,2.0,695.0,gadgets and gaming,2011-01-29 11:58:00, djantlive
330,Monster Beats Pro Headphones - Now Shipping.,SoundEarphones,01-28-2011 01:05 PM by SoundEarphones,0.0,966.0,gadgets and gaming,2011-01-28 13:05:00, SoundEarphones
331,JAYS a-JAYS Four :: Now Shipping @ SoundEarphones.com,SoundEarphones,01-27-2011 11:57 AM by SoundEarphones,2.0,1020.0,gadgets and gaming,2011-01-27 11:57:00, SoundEarphones
332,"Hidden Cable boxes, best remote control sensor-extenders?",ljg,01-26-2011 05:13 PM by ljg,2.0,7260.0,gadgets and gaming,2011-01-26 17:13:00, ljg
333,Shopping for a Receiver:  Educate Me,Barrister,01-25-2011 08:12 PM by Barrister,30.0,1877.0,gadgets and gaming,2011-01-25 20:12:00, Barrister
334,Is the PS3 still considered to be a quality stand-alone BD player?,Andrew,01-25-2011 03:28 PM by Andrew,12.0,979.0,gadgets and gaming,2011-01-25 15:28:00, Andrew
335,Official Team Speed Forza Motorsports 3 Tournament,kalifornicationx,10-19-2016 05:28 AM by kalifornicationx,88.0,13838.0,gadgets and gaming,2016-10-19 05:28:00, kalifornicationx
336,"Teamspeed To Go. Download the Teamspeed Mobile app for your iPhone, iPad, or Droid!",TEFF,03-14-2012 12:12 PM by TEFF,12.0,11496.0,gadgets and gaming,2012-03-14 12:12:00, TEFF
337,Selling Some Unopened PC Games,Barrister,01-24-2011 06:39 PM by Barrister,18.0,1133.0,gadgets and gaming,2011-01-24 18:39:00, Barrister
338,"Anyone looking for a 82"" LCD?  Have a few...",vtgts300kw,01-17-2011 07:31 PM by vtgts300kw,18.0,1124.0,gadgets and gaming,2011-01-17 19:31:00, vtgts300kw
339,Anyone have the new DC Universe MMO?,All We'll Drive,01-13-2011 04:48 PM by All We'll Drive,0.0,509.0,gadgets and gaming,2011-01-13 16:48:00, All We'll Drive
340,CES Reports?,stuka,01-10-2011 04:20 PM by stuka,2.0,558.0,gadgets and gaming,2011-01-10 16:20:00, stuka
341,"65"" is so 2010, try 72""",StealthPilot,01-09-2011 09:03 PM by StealthPilot,20.0,1844.0,gadgets and gaming,2011-01-09 21:03:00, StealthPilot
342,[PICS]: My new Sony 3D TV and Pioneer Elite AV Receiver | HT setup,RonnieRenaldi,01-06-2011 10:52 PM by RonnieRenaldi,21.0,4989.0,gadgets and gaming,2011-01-06 22:52:00, RonnieRenaldi
343,PS3 Netflix 5.1 surround mystery solved,Andrew,01-03-2011 04:12 PM by Andrew,3.0,2793.0,gadgets and gaming,2011-01-03 16:12:00, Andrew
344,"Educate me on ~60"" flat panal TV's",stuka,01-01-2011 12:40 AM by stuka,41.0,2559.0,gadgets and gaming,2011-01-01 00:40:00, stuka
345,Netflix PS3 Question,Andrew,12-31-2010 12:00 AM by Andrew,12.0,3394.0,gadgets and gaming,2010-12-31 00:00:00, Andrew
346,What to buy?  Laptop needed,ZAMIRZ,12-29-2010 02:39 AM by ZAMIRZ,50.0,2593.0,gadgets and gaming,2010-12-29 02:39:00, ZAMIRZ
347,Best user friendly Linux distro?,m5love,12-28-2010 11:21 PM by m5love,0.0,468.0,gadgets and gaming,2010-12-28 23:21:00, m5love
348,Which BB should I get,03-turbo911,12-28-2010 02:33 AM by 03-turbo911,27.0,1289.0,gadgets and gaming,2010-12-28 02:33:00, 03-turbo911
349,Logitech Revue with Google TV,chokeu2,12-24-2010 12:55 PM by chokeu2,5.0,556.0,gadgets and gaming,2010-12-24 12:55:00, chokeu2
350,LOL- Gifts you should return!,KT,12-23-2010 04:20 PM by KT,11.0,1126.0,gadgets and gaming,2010-12-23 16:20:00, KT
351,Klipsch Image One and S5i Rugged - Now Shipping!,SoundEarphones,12-21-2010 01:25 PM by SoundEarphones,0.0,477.0,gadgets and gaming,2010-12-21 13:25:00, SoundEarphones
352,Fastest Lap Game,ljg,12-16-2010 09:00 PM by ljg,33.0,1674.0,gadgets and gaming,2010-12-16 21:00:00, ljg
353,Out with the old,PorscheFanatic,12-16-2010 02:05 PM by PorscheFanatic,18.0,966.0,gadgets and gaming,2010-12-16 14:05:00, PorscheFanatic
354,WSJ Verizon to get iPhone in early 2011,richieporter,12-14-2010 09:39 PM by richieporter,5.0,563.0,gadgets and gaming,2010-12-14 21:39:00, richieporter
355,Fastest Lap Game,richieporter,12-14-2010 09:32 PM by richieporter,2.0,456.0,gadgets and gaming,2010-12-14 21:32:00, richieporter
356,Show us your gaming cockpit/seat etc.,Zymi,12-14-2010 01:23 PM by Zymi,15.0,2212.0,gadgets and gaming,2010-12-14 13:23:00, Zymi
357,Official Team Speed Forza Motorsports 3 Tournament,kalifornicationx,10-19-2016 05:28 AM by kalifornicationx,88.0,13838.0,gadgets and gaming,2016-10-19 05:28:00, kalifornicationx
358,"Teamspeed To Go. Download the Teamspeed Mobile app for your iPhone, iPad, or Droid!",TEFF,03-14-2012 12:12 PM by TEFF,12.0,11496.0,gadgets and gaming,2012-03-14 12:12:00, TEFF
359,My New Computer,djantlive,12-11-2010 09:47 PM by djantlive,1.0,444.0,gadgets and gaming,2010-12-11 21:47:00, djantlive
360,Random Ques about 360 Hard Drive,blackburry,12-11-2010 04:58 PM by blackburry,12.0,859.0,gadgets and gaming,2010-12-11 16:58:00, blackburry
361,PICTURES - Top 12 most luxurious custom made home theaters,Jpantel,12-10-2010 05:34 PM by Jpantel,19.0,4055.0,gadgets and gaming,2010-12-10 17:34:00, Jpantel
362,The Official Forza 3 gamer's thread,JonA85,12-08-2010 10:08 PM by JonA85,323.0,16228.0,gadgets and gaming,2010-12-08 22:08:00, JonA85
363,F1 2010,X2daC,12-08-2010 12:38 PM by X2daC,68.0,3348.0,gadgets and gaming,2010-12-08 12:38:00, X2daC
364,TJ Maxx - 16GB iPad for $399,ljg,12-07-2010 10:06 PM by ljg,20.0,1555.0,gadgets and gaming,2010-12-07 22:06:00, ljg
365,VIDEO - Halo Elite Costume,McRae,12-07-2010 05:26 PM by McRae,4.0,5056.0,gadgets and gaming,2010-12-07 17:26:00, McRae
366,Sonos... Anyone here tried the system?,Ludas,12-07-2010 03:14 AM by Ludas,5.0,865.0,gadgets and gaming,2010-12-07 03:14:00, Ludas
367,Homefront,STOPPIE,12-06-2010 03:49 PM by STOPPIE,4.0,428.0,gadgets and gaming,2010-12-06 15:49:00, STOPPIE
368,Google Adwords Voucher,propr`one,12-06-2010 02:23 PM by propr`one,0.0,358.0,gadgets and gaming,2010-12-06 14:23:00, propr`one
369,::The Official Android Thread::,h20skier,12-02-2010 11:31 PM by h20skier,31.0,1735.0,gadgets and gaming,2010-12-02 23:31:00, h20skier
370,Noise Cancelling for air travel,Edbrat,12-01-2010 05:44 PM by Edbrat,18.0,1269.0,gadgets and gaming,2010-12-01 17:44:00, Edbrat
371,Explorer 8 vs Google Chrome thoughts?,ashokn225,11-30-2010 05:31 PM by ashokn225,16.0,1084.0,gadgets and gaming,2010-11-30 17:31:00, ashokn225
372,downloading from youtube,Hot Shot,11-30-2010 05:34 AM by Hot Shot,10.0,903.0,gadgets and gaming,2010-11-30 05:34:00, Hot Shot
373,Cyber Monday deals,Hot Shot,11-29-2010 08:47 PM by Hot Shot,4.0,773.0,gadgets and gaming,2010-11-29 20:47:00, Hot Shot
374,Sennheiser MM550 Travel and PXC360 BT Headphones - Now Shipping.,SoundEarphones,11-17-2010 10:12 AM by SoundEarphones,0.0,1408.0,gadgets and gaming,2010-11-17 10:12:00, SoundEarphones
375,What IEMs should I get?,SoundEarphones,11-17-2010 10:11 AM by SoundEarphones,4.0,983.0,gadgets and gaming,2010-11-17 10:11:00, SoundEarphones
376,Outdoor Weatherproof TV,Jpantel,11-10-2010 08:13 PM by Jpantel,2.0,721.0,gadgets and gaming,2010-11-10 20:13:00, Jpantel
377,JAYS Earphones - Now available again at SoundEarphones,SoundEarphones,11-05-2010 03:46 PM by SoundEarphones,0.0,511.0,gadgets and gaming,2010-11-05 15:46:00, SoundEarphones
378,::Please Welcome back SoundEarphones to TEAMSPEED!::,SoundEarphones,10-31-2010 04:45 PM by SoundEarphones,6.0,639.0,gadgets and gaming,2010-10-31 16:45:00, SoundEarphones
379,Official Team Speed Forza Motorsports 3 Tournament,kalifornicationx,10-19-2016 05:28 AM by kalifornicationx,88.0,13838.0,gadgets and gaming,2016-10-19 05:28:00, kalifornicationx
380,"Teamspeed To Go. Download the Teamspeed Mobile app for your iPhone, iPad, or Droid!",TEFF,03-14-2012 12:12 PM by TEFF,12.0,11496.0,gadgets and gaming,2012-03-14 12:12:00, TEFF
381,Cobra iRadar,barchetta7550,10-30-2010 12:08 PM by barchetta7550,0.0,680.0,gadgets and gaming,2010-10-30 12:08:00, barchetta7550
382,ESCORT Announces PASSPORT iQ™ -- The World's First Fully Integrated Driving Accessory,SoCal,10-28-2010 06:37 AM by SoCal,4.0,1065.0,gadgets and gaming,2010-10-28 06:37:00, SoCal
383,The Official Battlefield Bad Company 2 Thread,sinan,10-25-2010 05:50 AM by sinan,2.0,499.0,gadgets and gaming,2010-10-25 05:50:00, sinan
384,samsung galaxy tablet,Alzilla,10-03-2010 10:45 PM by Alzilla,5.0,1629.0,gadgets and gaming,2010-10-03 22:45:00, Alzilla
385,TeamSpeed Forza Motorsport 3 Drawing!,Wild-Speed,10-01-2010 01:51 PM by Wild-Speed,10.0,1023.0,gadgets and gaming,2010-10-01 13:51:00, Wild-Speed
386,iPad Targus Stylus Review,chapsbk,09-30-2010 07:08 AM by chapsbk,0.0,1184.0,gadgets and gaming,2010-09-30 07:08:00, chapsbk
387,Blackberry launches Playbook rival to iPad,rico,09-29-2010 04:33 AM by rico,21.0,1560.0,gadgets and gaming,2010-09-29 04:33:00, rico
388,Outdoor Weatherproof TV,Jpantel,09-25-2010 10:35 PM by Jpantel,0.0,600.0,gadgets and gaming,2010-09-25 22:35:00, Jpantel
389,WTH? Google predictive text wont shut off,STOPPIE,09-25-2010 10:49 AM by STOPPIE,25.0,4248.0,gadgets and gaming,2010-09-25 10:49:00, STOPPIE
390,Got a new Galaxy S Android..,Curvejunkie,09-22-2010 07:25 PM by Curvejunkie,0.0,511.0,gadgets and gaming,2010-09-22 19:25:00, Curvejunkie
391,Need help: Buying an audio system for my Nephew,cleanme,09-20-2010 04:00 PM by cleanme,15.0,1012.0,gadgets and gaming,2010-09-20 16:00:00, cleanme
392,"Damn cable box, anyone have advice?",STOPPIE,09-19-2010 09:42 PM by STOPPIE,3.0,5392.0,gadgets and gaming,2010-09-19 21:42:00, STOPPIE
393,Android Help,strebo,09-19-2010 08:33 AM by strebo,3.0,569.0,gadgets and gaming,2010-09-19 08:33:00, strebo
394,New Thinkpad,Zymi,09-18-2010 01:32 PM by Zymi,13.0,1098.0,gadgets and gaming,2010-09-18 13:32:00, Zymi
395,The Official Halo Reach Thread,Ara,09-18-2010 01:04 PM by Ara,8.0,639.0,gadgets and gaming,2010-09-18 13:04:00, Ara
396,"New Thinkpad, Part 2",Jeff_NJ,09-18-2010 12:27 PM by Jeff_NJ,7.0,536.0,gadgets and gaming,2010-09-18 12:27:00, Jeff_NJ
397,changing wallpaper in windows 7 starter,IIVVX,09-17-2010 08:48 PM by IIVVX,0.0,831.0,gadgets and gaming,2010-09-17 20:48:00, IIVVX
398,Ordered my new Fanatec GT3 RS v2 Wheel,chapsbk,09-17-2010 03:24 AM by chapsbk,6.0,2321.0,gadgets and gaming,2010-09-17 03:24:00, chapsbk
399,GoPro and HD?,GrayTT,09-14-2010 10:46 AM by GrayTT,10.0,934.0,gadgets and gaming,2010-09-14 10:46:00, GrayTT
400,Starcraft II,Beef,09-11-2010 03:49 PM by Beef,17.0,1070.0,gadgets and gaming,2010-09-11 15:49:00, Beef
401,Official Team Speed Forza Motorsports 3 Tournament,kalifornicationx,10-19-2016 05:28 AM by kalifornicationx,88.0,13838.0,gadgets and gaming,2016-10-19 05:28:00, kalifornicationx
402,"Teamspeed To Go. Download the Teamspeed Mobile app for your iPhone, iPad, or Droid!",TEFF,03-14-2012 12:12 PM by TEFF,12.0,11496.0,gadgets and gaming,2012-03-14 12:12:00, TEFF
403,Looking for a robotic pool cleaner ??,sean,09-08-2010 02:23 PM by sean,3.0,571.0,gadgets and gaming,2010-09-08 14:23:00, sean
404,RC Boating - Looking for some advice,BigE,09-04-2010 09:41 AM by BigE,10.0,994.0,gadgets and gaming,2010-09-04 09:41:00, BigE
405,VIDEO - F1 2010 gameplay footage...MIND BLASTING!!!,All We'll Drive,09-01-2010 11:15 AM by All We'll Drive,11.0,812.0,gadgets and gaming,2010-09-01 11:15:00, All We'll Drive
406,3d TV's?,cstroked,08-30-2010 02:00 AM by cstroked,34.0,2136.0,gadgets and gaming,2010-08-30 02:00:00, cstroked
407,"Carbon ""beats by dr dre"" headphones",Chris from Cali,08-25-2010 11:38 PM by Chris from Cali,6.0,5933.0,gadgets and gaming,2010-08-25 23:38:00, Chris from Cali
408,"Official Team Speed Forza Motorsports 3 Tournament, Round 2",Bonita,08-25-2010 01:58 PM by Bonita,3.0,558.0,gadgets and gaming,2010-08-25 13:58:00, Bonita
409,New Earphones.  Suggestions?,GT3 KID,08-25-2010 01:16 AM by GT3 KID,17.0,972.0,gadgets and gaming,2010-08-25 01:16:00, GT3 KID
410,How Many Own the Palm Pre,theritz226,08-24-2010 10:27 PM by theritz226,0.0,487.0,gadgets and gaming,2010-08-24 22:27:00, theritz226
411,Star Wars MMO clip,All We'll Drive,08-20-2010 10:05 AM by All We'll Drive,2.0,589.0,gadgets and gaming,2010-08-20 10:05:00, All We'll Drive
412,PS3 Hacked!,cleanme,08-19-2010 01:15 PM by cleanme,2.0,497.0,gadgets and gaming,2010-08-19 13:15:00, cleanme
413,Going to make the leap- Verizon to ATT (for iPhone 4),STOPPIE,08-18-2010 04:20 PM by STOPPIE,36.0,1720.0,gadgets and gaming,2010-08-18 16:20:00, STOPPIE
414,PS4? so soon!!,Chris from Cali,08-17-2010 07:57 PM by Chris from Cali,26.0,5115.0,gadgets and gaming,2010-08-17 19:57:00, Chris from Cali
415,"So, who's got a Droid?",stuka,08-16-2010 10:53 PM by stuka,2.0,521.0,gadgets and gaming,2010-08-16 22:53:00, stuka
416,Guess who's back ?,ECB,08-16-2010 05:23 PM by ECB,4.0,583.0,gadgets and gaming,2010-08-16 17:23:00, ECB
417,Recs for a 32gb memory card?,bonehead,08-16-2010 01:20 PM by bonehead,9.0,583.0,gadgets and gaming,2010-08-16 13:20:00, bonehead
418,wireless night vision IP camera with sound,Gobbles,08-11-2010 12:10 AM by Gobbles,3.0,550.0,gadgets and gaming,2010-08-11 00:10:00, Gobbles
419,Droid X,stuka,08-05-2010 02:14 AM by stuka,0.0,468.0,gadgets and gaming,2010-08-05 02:14:00, stuka
420,help with ts on cell internet,TiAgMC,07-30-2010 11:25 PM by TiAgMC,2.0,506.0,gadgets and gaming,2010-07-30 23:25:00, TiAgMC
421,Who here played CS?!,GLN,07-25-2010 06:17 PM by GLN,9.0,622.0,gadgets and gaming,2010-07-25 18:17:00, GLN
422,DOW2 question.,sean73T,07-24-2010 03:17 AM by sean73T,0.0,402.0,gadgets and gaming,2010-07-24 03:17:00, sean73T
423,Official Team Speed Forza Motorsports 3 Tournament,kalifornicationx,10-19-2016 05:28 AM by kalifornicationx,88.0,13838.0,gadgets and gaming,2016-10-19 05:28:00, kalifornicationx
424,"Teamspeed To Go. Download the Teamspeed Mobile app for your iPhone, iPad, or Droid!",TEFF,03-14-2012 12:12 PM by TEFF,12.0,11496.0,gadgets and gaming,2012-03-14 12:12:00, TEFF
425,"32"" Tv",All We'll Drive,07-20-2010 05:02 PM by All We'll Drive,1.0,502.0,gadgets and gaming,2010-07-20 17:02:00, All We'll Drive
426,Droid X,carbonSSG,07-19-2010 03:35 PM by carbonSSG,13.0,1103.0,gadgets and gaming,2010-07-19 15:35:00, carbonSSG
427,Need help with Vegas Movie Studio 10.,Carrera,07-17-2010 07:31 AM by Carrera,0.0,480.0,gadgets and gaming,2010-07-17 07:31:00, Carrera
428,MAC/iPad + Crestron= Perfection,StanAi,07-12-2010 01:06 PM by StanAi,13.0,2545.0,gadgets and gaming,2010-07-12 13:06:00, StanAi
429,Calling Gaming PC Geeks... Advice on a new Rig...,daedalus,07-08-2010 02:57 PM by daedalus,18.0,1139.0,gadgets and gaming,2010-07-08 14:57:00, daedalus
430,Forza 3 Tournament Interested?,[email protected],06-28-2010 10:04 AM by [email protected],24.0,1427.0,gadgets and gaming,2010-06-28 10:04:00, [email protected]
431,iPhone OS 4.0 is on my phone!,Bronto,06-22-2010 07:17 AM by Bronto,11.0,1153.0,gadgets and gaming,2010-06-22 07:17:00, Bronto
432,"For those using older OS's such as XP, great font upgrade - Clear Type",03-turbo911,06-22-2010 04:14 AM by 03-turbo911,1.0,530.0,gadgets and gaming,2010-06-22 04:14:00, 03-turbo911
433,Wrc'10,vtgts300kw,06-21-2010 01:10 AM by vtgts300kw,4.0,554.0,gadgets and gaming,2010-06-21 01:10:00, vtgts300kw
434,E3 Expo Recap...Thus far,cleanme,06-20-2010 04:11 PM by cleanme,9.0,649.0,gadgets and gaming,2010-06-20 16:11:00, cleanme
435,PAL to NTSC converters,Gobbles,06-16-2010 11:01 AM by Gobbles,2.0,489.0,gadgets and gaming,2010-06-16 11:01:00, Gobbles
436,What service provider do you have? (Cell Phone),stuka,06-09-2010 01:31 PM by stuka,27.0,1409.0,gadgets and gaming,2010-06-09 13:31:00, stuka
437,Help with HD Camcorder,stuka,06-09-2010 01:00 AM by stuka,4.0,613.0,gadgets and gaming,2010-06-09 01:00:00, stuka
438,Am I screwed?,Mythic,06-06-2010 05:30 PM by Mythic,17.0,1247.0,gadgets and gaming,2010-06-06 17:30:00, Mythic
439,Call of Duty: Black Ops,Chris from Cali,06-06-2010 12:37 PM by Chris from Cali,28.0,1676.0,gadgets and gaming,2010-06-06 12:37:00, Chris from Cali
440,Do I need a new Video Card?,CrazyRuskie,06-03-2010 01:40 PM by CrazyRuskie,3.0,488.0,gadgets and gaming,2010-06-03 13:40:00, CrazyRuskie
441,"Dana, I'm Calling you out!! (Nerd Content)",Montana,06-02-2010 10:39 PM by Montana,16.0,1238.0,gadgets and gaming,2010-06-02 22:39:00, Montana
442,Pioneer Lab: PandoraLink,DJ,06-01-2010 03:48 PM by DJ,0.0,545.0,gadgets and gaming,2010-06-01 15:48:00, DJ
443,Blackberry replacement,MiniHawk,05-31-2010 12:39 AM by MiniHawk,6.0,600.0,gadgets and gaming,2010-05-31 00:39:00, MiniHawk
444,Read Dead Redemption.,sean,05-26-2010 02:40 AM by sean,5.0,466.0,gadgets and gaming,2010-05-26 02:40:00, sean
445,Official Team Speed Forza Motorsports 3 Tournament,kalifornicationx,10-19-2016 05:28 AM by kalifornicationx,88.0,13838.0,gadgets and gaming,2016-10-19 05:28:00, kalifornicationx
446,"Teamspeed To Go. Download the Teamspeed Mobile app for your iPhone, iPad, or Droid!",TEFF,03-14-2012 12:12 PM by TEFF,12.0,11496.0,gadgets and gaming,2012-03-14 12:12:00, TEFF
447,Top 10 Hardest Games...,Dynamic,05-19-2010 01:09 PM by Dynamic,8.0,800.0,gadgets and gaming,2010-05-19 13:09:00, Dynamic
448,Best Driving Simulator,Dynamic,05-14-2010 06:58 PM by Dynamic,13.0,5923.0,gadgets and gaming,2010-05-14 18:58:00, Dynamic
449,Bowers and Wilkins P5 Headphones,DJ,05-12-2010 01:31 PM by DJ,2.0,608.0,gadgets and gaming,2010-05-12 13:31:00, DJ
450,Latest pictures from Parkplace secure storage,tblackj,05-10-2010 02:29 PM by tblackj,5.0,883.0,gadgets and gaming,2010-05-10 14:29:00, tblackj
451,HTC (Droid) Incredible to be released 4/29,Bonita,05-10-2010 01:00 PM by Bonita,12.0,1193.0,gadgets and gaming,2010-05-10 13:00:00, Bonita
452,Arcam Solo Movie 5.1 - worth the $$$??,slik560,05-10-2010 12:49 PM by slik560,0.0,576.0,gadgets and gaming,2010-05-10 12:49:00, slik560
453,Look Out! Daddy's Got A Brand New Toy . . .,Bonita,05-07-2010 08:43 AM by Bonita,40.0,2902.0,gadgets and gaming,2010-05-07 08:43:00, Bonita
454,15% Off Mothers Day Sale!,SoundEarphones,05-04-2010 03:43 PM by SoundEarphones,0.0,465.0,gadgets and gaming,2010-05-04 15:43:00, SoundEarphones
455,Klipsch SXT iPod Dock - On TS Special,Schwabe,05-03-2010 03:12 PM by Schwabe,1.0,553.0,gadgets and gaming,2010-05-03 15:12:00, Schwabe
456,Just Ordered A New Gaming Rig - Falcon Northwest Mach V,Shadow,05-02-2010 05:37 PM by Shadow,51.0,3129.0,gadgets and gaming,2010-05-02 17:37:00, Shadow
457,BlackBerry Pearl 3G revealed: two keypad styles and 802.11n WiFi,Striker,04-26-2010 01:18 PM by Striker,3.0,475.0,gadgets and gaming,2010-04-26 13:18:00, Striker
458,"BlackBerry Bold 9650 announced, targets Tour owners' big complaints",DJ,04-26-2010 12:20 PM by DJ,0.0,512.0,gadgets and gaming,2010-04-26 12:20:00, DJ
459,Stupid Q about location of cable modem,propr`one,04-25-2010 01:49 PM by propr`one,3.0,455.0,gadgets and gaming,2010-04-25 13:49:00, propr`one
460,Anyone Have A Connection for These Pendent Lights?,Still Lost,04-24-2010 03:15 PM by Still Lost,0.0,392.0,gadgets and gaming,2010-04-24 15:15:00, Still Lost
461,Shure 530 or SuperFi 10? IEM recommendations,freshdown,04-23-2010 01:58 PM by freshdown,6.0,597.0,gadgets and gaming,2010-04-23 13:58:00, freshdown
462,PSA: Instant Starcraft 2 Beta access when you preorder from GameStop,Dynamic,04-21-2010 10:11 AM by Dynamic,0.0,466.0,gadgets and gaming,2010-04-21 10:11:00, Dynamic
463,New nüvi 3700 series redefines look and feel of personal navigation,DJ,04-19-2010 02:14 PM by DJ,0.0,424.0,gadgets and gaming,2010-04-19 14:14:00, DJ
464,Gears of War 3 ahses to ashes trailer  is Epic,Wearymicrobe,04-14-2010 08:52 PM by Wearymicrobe,7.0,499.0,gadgets and gaming,2010-04-14 20:52:00, Wearymicrobe
465,Sennheiser HD 448 Headphones - Back in stock @ SoundEarphones,SoundEarphones,04-14-2010 02:21 PM by SoundEarphones,0.0,442.0,gadgets and gaming,2010-04-14 14:21:00, SoundEarphones
466,Awesome Commercial,JCay,04-09-2010 08:13 PM by JCay,3.0,451.0,gadgets and gaming,2010-04-09 20:13:00, JCay
467,Official Team Speed Forza Motorsports 3 Tournament,kalifornicationx,10-19-2016 05:28 AM by kalifornicationx,88.0,13838.0,gadgets and gaming,2016-10-19 05:28:00, kalifornicationx
468,"Teamspeed To Go. Download the Teamspeed Mobile app for your iPhone, iPad, or Droid!",TEFF,03-14-2012 12:12 PM by TEFF,12.0,11496.0,gadgets and gaming,2012-03-14 12:12:00, TEFF
469,Buffalo WHR-HP-G54 Router,STLG,04-07-2010 08:38 PM by STLG,5.0,485.0,gadgets and gaming,2010-04-07 20:38:00, STLG
470,password help,burnzie,03-29-2010 11:03 PM by burnzie,4.0,595.0,gadgets and gaming,2010-03-29 23:03:00, burnzie
471,I'm glad I have Sprint - HTC Evo 4G announced today,Dynamic,03-24-2010 07:09 PM by Dynamic,1.0,889.0,gadgets and gaming,2010-03-24 19:09:00, Dynamic
472,Best Auto racing/chase movie?,daedalus,03-24-2010 04:58 PM by daedalus,20.0,1328.0,gadgets and gaming,2010-03-24 16:58:00, daedalus
473,Mass Effect 2 fans out there?,Wearymicrobe,03-21-2010 11:44 AM by Wearymicrobe,10.0,804.0,gadgets and gaming,2010-03-21 11:44:00, Wearymicrobe
474,God Of War III For PS3,Chris from Cali,03-18-2010 03:37 PM by Chris from Cali,4.0,369.0,gadgets and gaming,2010-03-18 15:37:00, Chris from Cali
475,Can you say Perfect Dark?,Dynamic,03-18-2010 01:54 AM by Dynamic,11.0,894.0,gadgets and gaming,2010-03-18 01:54:00, Dynamic
476,Klipsch Image X10i - Now Shipping!,SoundEarphones,03-17-2010 12:13 PM by SoundEarphones,0.0,426.0,gadgets and gaming,2010-03-17 12:13:00, SoundEarphones
477,Coolest Gear - Bugatti Veyron Themed Sony PSP GO,4Wheels,03-16-2010 11:53 AM by 4Wheels,2.0,759.0,gadgets and gaming,2010-03-16 11:53:00, 4Wheels
478,dodgy site or what?,Nav,03-12-2010 03:07 PM by Nav,1.0,583.0,gadgets and gaming,2010-03-12 15:07:00, Nav
479,"New GT5 ""nights"" Video - Trailer",edbhr,03-10-2010 06:58 PM by edbhr,13.0,792.0,gadgets and gaming,2010-03-10 18:58:00, edbhr
480,PS3 Suffering From Global Network Lockdown,Nav,03-09-2010 03:10 PM by Nav,31.0,1277.0,gadgets and gaming,2010-03-09 15:10:00, Nav
481,How to connect TV to wireless network at home?,Nav,03-09-2010 03:02 PM by Nav,7.0,946.0,gadgets and gaming,2010-03-09 15:02:00, Nav
482,The Official F1 2010 Thread,strebo,03-09-2010 04:33 AM by strebo,7.0,489.0,gadgets and gaming,2010-03-09 04:33:00, strebo
483,Beyerdynamic - Now Available @ SoundEarphones,SoundEarphones,03-04-2010 02:03 PM by SoundEarphones,0.0,374.0,gadgets and gaming,2010-03-04 14:03:00, SoundEarphones
484,Blackberry 9700,crazy1323,03-03-2010 12:31 AM by crazy1323,19.0,1252.0,gadgets and gaming,2010-03-03 00:31:00, crazy1323
485,MLB 10 The Show On PS3,Barrister,03-02-2010 10:46 PM by Barrister,0.0,394.0,gadgets and gaming,2010-03-02 22:46:00, Barrister
486,H2O Audio - Now Available @SoundEarphones,STLG,02-23-2010 08:52 PM by STLG,5.0,403.0,gadgets and gaming,2010-02-23 20:52:00, STLG
487,10% Off Your Order @ SoundEarphones,SoundEarphones,02-23-2010 04:08 PM by SoundEarphones,0.0,386.0,gadgets and gaming,2010-02-23 16:08:00, SoundEarphones
488,The official Gran Turismo 5's European Box !!!,Chris from Cali,02-22-2010 06:05 PM by Chris from Cali,34.0,2773.0,gadgets and gaming,2010-02-22 18:05:00, Chris from Cali
489,Official Team Speed Forza Motorsports 3 Tournament,kalifornicationx,10-19-2016 05:28 AM by kalifornicationx,88.0,13838.0,gadgets and gaming,2016-10-19 05:28:00, kalifornicationx
490,"Teamspeed To Go. Download the Teamspeed Mobile app for your iPhone, iPad, or Droid!",TEFF,03-14-2012 12:12 PM by TEFF,12.0,11496.0,gadgets and gaming,2012-03-14 12:12:00, TEFF
491,Star Trek Online,Barrister,02-12-2010 06:24 PM by Barrister,9.0,499.0,gadgets and gaming,2010-02-12 18:24:00, Barrister
492,I can't believe Lexicon would stoop this low,Wearymicrobe,02-09-2010 09:23 PM by Wearymicrobe,16.0,1166.0,gadgets and gaming,2010-02-09 21:23:00, Wearymicrobe
493,Monster Turbine PRO Earphones in Copper - Now shipping!,SoundEarphones,02-01-2010 12:14 PM by SoundEarphones,0.0,419.0,gadgets and gaming,2010-02-01 12:14:00, SoundEarphones
494,New Apple iPad,andy102,01-28-2010 03:03 PM by andy102,12.0,938.0,gadgets and gaming,2010-01-28 15:03:00, andy102
495,Bluetooth plz help??,PatrickHenry,01-26-2010 12:52 AM by PatrickHenry,2.0,436.0,gadgets and gaming,2010-01-26 00:52:00, PatrickHenry
496,Mag,Chris from Cali,01-25-2010 08:45 PM by Chris from Cali,4.0,447.0,gadgets and gaming,2010-01-25 20:45:00, Chris from Cali
497,Mass Effect 2 - Who's Excited!?,KimoTh3rapy,01-25-2010 11:39 AM by KimoTh3rapy,6.0,484.0,gadgets and gaming,2010-01-25 11:39:00, KimoTh3rapy
498,Best bumper sticker ever,burnzie,01-24-2010 02:50 AM by burnzie,0.0,606.0,gadgets and gaming,2010-01-24 02:50:00, burnzie
499,Westone Earphones - Now Available @ SoundEarphones,SoundEarphones,01-22-2010 07:46 PM by SoundEarphones,0.0,436.0,gadgets and gaming,2010-01-22 19:46:00, SoundEarphones
500,15% Off @ SoundEarphones,SoundEarphones,01-20-2010 05:04 PM by SoundEarphones,0.0,420.0,gadgets and gaming,2010-01-20 17:04:00, SoundEarphones
501,Gateway pumps out EC Series ultraportables,Schwabe,01-19-2010 11:49 AM by Schwabe,4.0,952.0,gadgets and gaming,2010-01-19 11:49:00, Schwabe
502,What's your favourite game of all time?,Nath4N,01-13-2010 03:42 PM by Nath4N,45.0,2114.0,gadgets and gaming,2010-01-13 15:42:00, Nath4N
503,Shii: The Wii for her ...,Mayoof,01-01-2010 06:02 AM by Mayoof,10.0,1107.0,gadgets and gaming,2010-01-01 06:02:00, Mayoof
504,Modern Warfare 2 Single Player Story (Spoilers),Gobbles,12-30-2009 10:05 PM by Gobbles,8.0,488.0,gadgets and gaming,2009-12-30 22:05:00, Gobbles
505,Year-End Sale @ SoundEarphones,SoundEarphones,12-26-2009 03:48 PM by SoundEarphones,0.0,456.0,gadgets and gaming,2009-12-26 15:48:00, SoundEarphones
506,iPhone Developer Tapulous Captures Sales of Nearly $1 Million Per Month,DJ,12-24-2009 06:28 PM by DJ,0.0,522.0,gadgets and gaming,2009-12-24 18:28:00, DJ
507,15% Off @ SoundEarphones.com,Christian,12-21-2009 12:17 PM by Christian,1.0,447.0,gadgets and gaming,2009-12-21 12:17:00, Christian
508,Comcast vs. Verizon Fios,All We'll Drive,12-21-2009 11:39 AM by All We'll Drive,7.0,1047.0,gadgets and gaming,2009-12-21 11:39:00, All We'll Drive
509,New Sennheiser Headphones - Now In Stock.,SoundEarphones,12-16-2009 01:36 PM by SoundEarphones,0.0,1874.0,gadgets and gaming,2009-12-16 13:36:00, SoundEarphones
510,Real Cheap Plasma,gfroman,12-15-2009 08:43 PM by gfroman,14.0,1090.0,gadgets and gaming,2009-12-15 20:43:00, gfroman
511,Official Team Speed Forza Motorsports 3 Tournament,kalifornicationx,10-19-2016 05:28 AM by kalifornicationx,88.0,13838.0,gadgets and gaming,2016-10-19 05:28:00, kalifornicationx
512,"Teamspeed To Go. Download the Teamspeed Mobile app for your iPhone, iPad, or Droid!",TEFF,03-14-2012 12:12 PM by TEFF,12.0,11496.0,gadgets and gaming,2012-03-14 12:12:00, TEFF
513,Digital Photo Albums,Gobbles,12-11-2009 10:40 AM by Gobbles,3.0,484.0,gadgets and gaming,2009-12-11 10:40:00, Gobbles
514,XBOX360 Elite or new PS3...,smokinghot4cars,12-08-2009 01:21 PM by smokinghot4cars,41.0,2083.0,gadgets and gaming,2009-12-08 13:21:00, smokinghot4cars
515,Wireless electricity demo: Eric Giler on TED.com,Schwabe,12-07-2009 10:30 PM by Schwabe,16.0,1010.0,gadgets and gaming,2009-12-07 22:30:00, Schwabe
516,"Is there a ""Show us your home-theater or tv room setup"" thread?",DchaMD,11-30-2009 04:59 PM by DchaMD,1.0,1038.0,gadgets and gaming,2009-11-30 16:59:00, DchaMD
517,What to buy instead of a Blose Wave?,stuka,11-27-2009 06:42 PM by stuka,21.0,1703.0,gadgets and gaming,2009-11-27 18:42:00, stuka
518,Good external hard drive?,SoCal,11-27-2009 01:49 PM by SoCal,11.0,876.0,gadgets and gaming,2009-11-27 13:49:00, SoCal
519,Black Friday Specials @ SoundEarphones,SoundEarphones,11-26-2009 09:23 AM by SoundEarphones,0.0,551.0,gadgets and gaming,2009-11-26 09:23:00, SoundEarphones
520,Flat screen TV Question,domesticdemon,11-24-2009 06:22 PM by domesticdemon,5.0,516.0,gadgets and gaming,2009-11-24 18:22:00, domesticdemon
521,Google Maps Navigation officially comes to Android 1.6,ljg,11-23-2009 09:50 PM by ljg,1.0,422.0,gadgets and gaming,2009-11-23 21:50:00, ljg
522,Awesome Gulf Porsche 917-inspired couch!,Alzilla,11-22-2009 05:03 PM by Alzilla,0.0,1781.0,gadgets and gaming,2009-11-22 17:03:00, Alzilla
523,Sleek-Audio SA1 - Now Available for Pre Order!,SoundEarphones,11-21-2009 03:12 PM by SoundEarphones,1.0,640.0,gadgets and gaming,2009-11-21 15:12:00, SoundEarphones
524,Grado iGi Earphones - Back in stock @ SoundEarphones,SoundEarphones,11-21-2009 03:12 PM by SoundEarphones,14.0,1535.0,gadgets and gaming,2009-11-21 15:12:00, SoundEarphones
525,PS3 Locked up and won't function?,TUUNER,11-20-2009 01:23 PM by TUUNER,6.0,619.0,gadgets and gaming,2009-11-20 13:23:00, TUUNER
526,Brit Blog Names iPhone 'World's Worst',Chris from Cali,11-19-2009 10:50 PM by Chris from Cali,13.0,849.0,gadgets and gaming,2009-11-19 22:50:00, Chris from Cali
527,iPod-ready 2-channel x 2 room music system for under $600?,djantlive,11-18-2009 12:43 PM by djantlive,3.0,440.0,gadgets and gaming,2009-11-18 12:43:00, djantlive
528,"Motorola Droid gets fully previewed, 'must-have' claims may not be far off",joekimdds,11-17-2009 04:48 PM by joekimdds,12.0,1076.0,gadgets and gaming,2009-11-17 16:48:00, joekimdds
529,Need For Speed: Shift,adamr,11-13-2009 09:46 AM by adamr,79.0,4199.0,gadgets and gaming,2009-11-13 09:46:00, adamr
530,Audiophile CABLES For Sale!!,gfroman,11-12-2009 07:14 PM by gfroman,0.0,981.0,gadgets and gaming,2009-11-12 19:14:00, gfroman
531,FS :Aerial Acoustics 20T - Flagship Speakers,ProspectM,11-12-2009 05:46 PM by ProspectM,15.0,3118.0,gadgets and gaming,2009-11-12 17:46:00, ProspectM
532,Shure SRH750DJ DJ Headphones :: In-Stock!,SoundEarphones,11-12-2009 02:12 PM by SoundEarphones,2.0,581.0,gadgets and gaming,2009-11-12 14:12:00, SoundEarphones
533,Official Team Speed Forza Motorsports 3 Tournament,kalifornicationx,10-19-2016 05:28 AM by kalifornicationx,88.0,13838.0,gadgets and gaming,2016-10-19 05:28:00, kalifornicationx
534,"Teamspeed To Go. Download the Teamspeed Mobile app for your iPhone, iPad, or Droid!",TEFF,03-14-2012 12:12 PM by TEFF,12.0,11496.0,gadgets and gaming,2012-03-14 12:12:00, TEFF
535,"SEMA 2009: Rev for iPhone reaches 2.0, includes data-logging [w/ VIDEO]",MattYeu,11-11-2009 08:33 AM by MattYeu,1.0,479.0,gadgets and gaming,2009-11-11 08:33:00, MattYeu
536,The Ford Mustang Trans-Cammer 1970 will be in Gran Turismo 5,MattYeu,11-11-2009 07:51 AM by MattYeu,0.0,3301.0,gadgets and gaming,2009-11-11 07:51:00, MattYeu
537,2 channel amp/receiver for home theater?,big_slacker,11-09-2009 01:03 AM by big_slacker,6.0,923.0,gadgets and gaming,2009-11-09 01:03:00, big_slacker
538,VIDEO Blackberry Tour 2 (Codename Essex) Overview,DJ,11-06-2009 01:45 PM by DJ,0.0,442.0,gadgets and gaming,2009-11-06 13:45:00, DJ
539,Incredible Modern Warfare 2 pre-release video!,Chris from Cali,11-05-2009 05:59 PM by Chris from Cali,20.0,1043.0,gadgets and gaming,2009-11-05 17:59:00, Chris from Cali
540,MW2 predicted to be the biggest entertainment release of all time *new trailer*,Bronto,11-05-2009 05:25 PM by Bronto,7.0,443.0,gadgets and gaming,2009-11-05 17:25:00, Bronto
541,Verizon Wireless Introduces the BlackBerry Curve 8530 Smartphone,DJ,11-05-2009 10:49 AM by DJ,0.0,409.0,gadgets and gaming,2009-11-05 10:49:00, DJ
542,Flickr Help,Shadow,11-03-2009 10:54 AM by Shadow,5.0,407.0,gadgets and gaming,2009-11-03 10:54:00, Shadow
543,Grado PS1000 Headphones - Now In Stock!,SoundEarphones,11-02-2009 01:27 PM by SoundEarphones,0.0,383.0,gadgets and gaming,2009-11-02 13:27:00, SoundEarphones
544,Incredible news for everyone who's waiting on Gran Turismo 5,All We'll Drive,10-27-2009 03:21 PM by All We'll Drive,14.0,670.0,gadgets and gaming,2009-10-27 15:21:00, All We'll Drive
545,"BlackBerry Bold 9700 announced, launching globally starting next month",Craigger,10-22-2009 03:20 PM by Craigger,8.0,537.0,gadgets and gaming,2009-10-22 15:20:00, Craigger
546,Fifa 10,Chris from Cali,10-21-2009 04:52 PM by Chris from Cali,8.0,452.0,gadgets and gaming,2009-10-21 16:52:00, Chris from Cali
547,Lenovo slaps Windows 7 onto ThinkPad SL410 and SL510,Dunner,10-21-2009 03:12 PM by Dunner,1.0,1321.0,gadgets and gaming,2009-10-21 15:12:00, Dunner
548,"Damn you, FORZA!",BigE,10-20-2009 08:56 PM by BigE,92.0,4640.0,gadgets and gaming,2009-10-20 20:56:00, BigE
549,October Coupon @ SoundEarphones!,SoundEarphones,10-18-2009 01:52 PM by SoundEarphones,0.0,499.0,gadgets and gaming,2009-10-18 13:52:00, SoundEarphones
550,"RIM goes pale, shows white Curve 8520 for T-Mobile and Bold for AT&T",Tsar,10-14-2009 02:39 PM by Tsar,12.0,938.0,gadgets and gaming,2009-10-14 14:39:00, Tsar
551,BW Zepplin,sheynk,10-14-2009 09:44 AM by sheynk,9.0,586.0,gadgets and gaming,2009-10-14 09:44:00, sheynk
552,Viper app allows remote start of your car with iPhone,DJ,10-13-2009 10:38 PM by DJ,0.0,873.0,gadgets and gaming,2009-10-13 22:38:00, DJ
553,New Modern Warfare 2 trailer out today,Dynamic,10-10-2009 03:18 AM by Dynamic,26.0,1120.0,gadgets and gaming,2009-10-10 03:18:00, Dynamic
554,The Harmony Remote 900 by Logitech,JarodL,10-07-2009 02:21 PM by JarodL,13.0,857.0,gadgets and gaming,2009-10-07 14:21:00, JarodL
555,Official Team Speed Forza Motorsports 3 Tournament,kalifornicationx,10-19-2016 05:28 AM by kalifornicationx,88.0,13838.0,gadgets and gaming,2016-10-19 05:28:00, kalifornicationx
556,"Teamspeed To Go. Download the Teamspeed Mobile app for your iPhone, iPad, or Droid!",TEFF,03-14-2012 12:12 PM by TEFF,12.0,11496.0,gadgets and gaming,2012-03-14 12:12:00, TEFF
557,McIntosh Goes Lifestyle,SoundEarphones,10-06-2009 09:30 PM by SoundEarphones,9.0,516.0,gadgets and gaming,2009-10-06 21:30:00, SoundEarphones
558,Webcam suggestions,stuka,10-05-2009 01:03 PM by stuka,11.0,724.0,gadgets and gaming,2009-10-05 13:03:00, stuka
559,Love this home theater set-up,Christian,10-03-2009 11:18 PM by Christian,2.0,549.0,gadgets and gaming,2009-10-03 23:18:00, Christian
560,PSP and Gran Turismo?,All We'll Drive,10-03-2009 01:20 AM by All We'll Drive,16.0,987.0,gadgets and gaming,2009-10-03 01:20:00, All We'll Drive
561,Anyone play PURE?,All We'll Drive,10-02-2009 03:27 PM by All We'll Drive,1.0,299.0,gadgets and gaming,2009-10-02 15:27:00, All We'll Drive
562,Anyone get a PSP Go yet,All We'll Drive,10-02-2009 02:58 PM by All We'll Drive,10.0,666.0,gadgets and gaming,2009-10-02 14:58:00, All We'll Drive
563,Modern Warfare 2... PS3 or X360?,sean,10-01-2009 06:57 PM by sean,16.0,764.0,gadgets and gaming,2009-10-01 18:57:00, sean
564,Klipsch iGroove SXT iPod Dock - Now in stock!,SoundEarphones,10-01-2009 11:57 AM by SoundEarphones,0.0,355.0,gadgets and gaming,2009-10-01 11:57:00, SoundEarphones
565,So I was excited for Modern Warfare 2 until I saw this...,Zorro,09-30-2009 04:59 PM by Zorro,6.0,471.0,gadgets and gaming,2009-09-30 16:59:00, Zorro
566,Where to find these Flat Panel TV Stands/Support Panels,GLN,09-30-2009 12:20 AM by GLN,2.0,831.0,gadgets and gaming,2009-09-30 00:20:00, GLN
567,"So, this is what a 16K a pair speaker sounds like",Zorro,09-29-2009 11:45 PM by Zorro,10.0,932.0,gadgets and gaming,2009-09-29 23:45:00, Zorro
568,Mafia Wars on Facebook,GrayTT,09-27-2009 06:43 AM by GrayTT,20.0,1220.0,gadgets and gaming,2009-09-27 06:43:00, GrayTT
569,"TomTom's iPhone car kit will cost $120, app sold separately!",ljg,09-26-2009 04:08 PM by ljg,2.0,497.0,gadgets and gaming,2009-09-26 16:08:00, ljg
570,New local dimming Samsung announced,TTM0TION,09-23-2009 02:00 PM by TTM0TION,1.0,406.0,gadgets and gaming,2009-09-23 14:00:00, TTM0TION
571,Earphones for riding?,SoCal,09-22-2009 05:33 AM by SoCal,6.0,706.0,gadgets and gaming,2009-09-22 05:33:00, SoCal
572,"Anyone know a good AV Installer in Lake County, IL?",alin2.5,09-17-2009 07:59 PM by alin2.5,3.0,381.0,gadgets and gaming,2009-09-17 19:59:00, alin2.5
573,Wadia iTransport - Now Available,SoundEarphones,09-11-2009 02:35 AM by SoundEarphones,0.0,387.0,gadgets and gaming,2009-09-11 02:35:00, SoundEarphones
574,New Lower Price on the PS Audio Power Plant Premier.,SoundEarphones,09-08-2009 02:48 AM by SoundEarphones,0.0,436.0,gadgets and gaming,2009-09-08 02:48:00, SoundEarphones
575,Wireless outdoor speaker recommendation,45otto,09-07-2009 03:27 PM by 45otto,0.0,290.0,gadgets and gaming,2009-09-07 15:27:00, 45otto
576,Study Shows Traffic-Enabled Navigation Can Save Drivers 4 Days per Year,DJ,08-28-2009 02:07 AM by DJ,0.0,401.0,gadgets and gaming,2009-08-28 02:07:00, DJ
577,Official Team Speed Forza Motorsports 3 Tournament,kalifornicationx,10-19-2016 05:28 AM by kalifornicationx,88.0,13838.0,gadgets and gaming,2016-10-19 05:28:00, kalifornicationx
578,"Teamspeed To Go. Download the Teamspeed Mobile app for your iPhone, iPad, or Droid!",TEFF,03-14-2012 12:12 PM by TEFF,12.0,11496.0,gadgets and gaming,2012-03-14 12:12:00, TEFF
579,Skullcandy & Beats By Dre - Now Available @ SoundEarphones,SoundEarphones,08-27-2009 09:18 AM by SoundEarphones,0.0,368.0,gadgets and gaming,2009-08-27 09:18:00, SoundEarphones
580,Ultrasone Zino Headphones - Now In Stock.,SoundEarphones,08-27-2009 09:15 AM by SoundEarphones,0.0,398.0,gadgets and gaming,2009-08-27 09:15:00, SoundEarphones
581,Free Additional Year Warranty on All Ultrasone Headphones!,SoundEarphones,08-25-2009 06:19 PM by SoundEarphones,0.0,387.0,gadgets and gaming,2009-08-25 18:19:00, SoundEarphones
582,Klipsch Image S4 - Now In-Stock!,SoundEarphones,08-18-2009 10:43 AM by SoundEarphones,3.0,907.0,gadgets and gaming,2009-08-18 10:43:00, SoundEarphones
583,Nad M15hd,stuka,08-17-2009 09:35 PM by stuka,0.0,623.0,gadgets and gaming,2009-08-17 21:35:00, stuka
584,SoundEarphones.com Summer Coupons,SoundEarphones,08-16-2009 08:29 PM by SoundEarphones,1.0,665.0,gadgets and gaming,2009-08-16 20:29:00, SoundEarphones
585,Wireless Help,X2daC,08-10-2009 01:50 AM by X2daC,2.0,373.0,gadgets and gaming,2009-08-10 01:50:00, X2daC
586,Hey TS Gamers - Latest Forza 3 update highlights American Muscle,TTM0TION,08-09-2009 11:14 PM by TTM0TION,14.0,2098.0,gadgets and gaming,2009-08-09 23:14:00, TTM0TION
587,The Ultimate Desk Accessory: Carbon Fiber and Leather Mousepad,skizot,08-09-2009 09:47 PM by skizot,1.0,2808.0,gadgets and gaming,2009-08-09 21:47:00, skizot
588,Laptop Help (again)! please :),STLG,08-09-2009 04:55 PM by STLG,6.0,420.0,gadgets and gaming,2009-08-09 16:55:00, STLG
589,Klipach Image S2 - Now Available @ SoundEarphones.com,SoundEarphones,08-07-2009 08:57 PM by SoundEarphones,0.0,332.0,gadgets and gaming,2009-08-07 20:57:00, SoundEarphones
590,Let's see your A/V setup!,X2daC,08-05-2009 01:07 AM by X2daC,12.0,1169.0,gadgets and gaming,2009-08-05 01:07:00, X2daC
591,New Grado GR8 In-Ear Earphones!,SoundEarphones,07-31-2009 08:55 PM by SoundEarphones,0.0,456.0,gadgets and gaming,2009-07-31 20:55:00, SoundEarphones
592,Streaming media to your Television,Travis_D,07-30-2009 10:16 PM by Travis_D,10.0,893.0,gadgets and gaming,2009-07-30 22:16:00, Travis_D
593,"Verizon rumored to be pushing up LTE plans to Q1 2010, new Apple device the catalyst?",DJ,07-27-2009 03:01 PM by DJ,1.0,470.0,gadgets and gaming,2009-07-27 15:01:00, DJ
594,Grado Headphones are now available @ SoundEarphones,SoundEarphones,07-26-2009 07:46 PM by SoundEarphones,3.0,698.0,gadgets and gaming,2009-07-26 19:46:00, SoundEarphones
595,Laptop Suggestions?,STLG,07-26-2009 06:05 PM by STLG,15.0,1149.0,gadgets and gaming,2009-07-26 18:05:00, STLG
596,URC debuts MX-5000 universal remote with haptic feedback,.:Raul,07-20-2009 07:04 PM by .:Raul,3.0,395.0,gadgets and gaming,2009-07-20 19:04:00, .:Raul
597,BlackBerry Desktop Manager coming to Mac in September,DJ,07-20-2009 06:09 PM by DJ,0.0,335.0,gadgets and gaming,2009-07-20 18:09:00, DJ
598,What is the state of SSD's?,Schwabe,07-19-2009 10:20 PM by Schwabe,6.0,487.0,gadgets and gaming,2009-07-19 22:20:00, Schwabe
599,Official Team Speed Forza Motorsports 3 Tournament,kalifornicationx,10-19-2016 05:28 AM by kalifornicationx,88.0,13838.0,gadgets and gaming,2016-10-19 05:28:00, kalifornicationx
600,"Teamspeed To Go. Download the Teamspeed Mobile app for your iPhone, iPad, or Droid!",TEFF,03-14-2012 12:12 PM by TEFF,12.0,11496.0,gadgets and gaming,2012-03-14 12:12:00, TEFF
601,"Sennheiser HD428, HD348 and HD448 - Now In Stock!",SoundEarphones,07-17-2009 04:48 PM by SoundEarphones,0.0,2227.0,gadgets and gaming,2009-07-17 16:48:00, SoundEarphones
602,Benchmark Media - Now Available @ SoundEarphones,SoundEarphones,07-16-2009 08:14 PM by SoundEarphones,0.0,342.0,gadgets and gaming,2009-07-16 20:14:00, SoundEarphones
603,RIM Unveils Blackberry Tour 9630,Tyler,07-14-2009 07:26 PM by Tyler,16.0,1674.0,gadgets and gaming,2009-07-14 19:26:00, Tyler
604,PS3 future pricing?,sean,07-06-2009 04:49 PM by sean,10.0,747.0,gadgets and gaming,2009-07-06 16:49:00, sean
605,Noise cancellation Headphone Q for Mike,Schwabe,07-04-2009 06:57 PM by Schwabe,10.0,725.0,gadgets and gaming,2009-07-04 18:57:00, Schwabe
606,1-Day Sale @ SoundEarphones.com,SoundEarphones,07-04-2009 09:59 AM by SoundEarphones,0.0,380.0,gadgets and gaming,2009-07-04 09:59:00, SoundEarphones
607,Woodees Earphones - Now Available @ SoundEarphones,SoundEarphones,07-02-2009 09:10 PM by SoundEarphones,0.0,333.0,gadgets and gaming,2009-07-02 21:10:00, SoundEarphones
608,Ultrasone Edition 8 Headphones - Now Available,SoundEarphones,07-02-2009 12:59 PM by SoundEarphones,2.0,493.0,gadgets and gaming,2009-07-02 12:59:00, SoundEarphones
609,Ghostbusters: The Video Game!,sean,06-27-2009 02:15 AM by sean,4.0,380.0,gadgets and gaming,2009-06-27 02:15:00, sean
610,iPhone 3GS review by engadget,LABrit,06-24-2009 05:26 AM by LABrit,4.0,556.0,gadgets and gaming,2009-06-24 05:26:00, LABrit
611,First Modern Warfare 2 footage from the Celtics game,Chris from Cali,06-22-2009 09:26 PM by Chris from Cali,14.0,736.0,gadgets and gaming,2009-06-22 21:26:00, Chris from Cali
612,"Yo, thedude, XBR9 is out",Chris from Cali,06-17-2009 12:35 AM by Chris from Cali,19.0,2374.0,gadgets and gaming,2009-06-17 00:35:00, Chris from Cali
613,Forza 3 Video,All We'll Drive,06-16-2009 06:06 PM by All We'll Drive,2.0,405.0,gadgets and gaming,2009-06-16 18:06:00, All We'll Drive
614,DJ Hero,vtgts300kw,06-15-2009 06:59 PM by vtgts300kw,4.0,405.0,gadgets and gaming,2009-06-15 18:59:00, vtgts300kw
615,Home Theater Subwoofer for under 2500 bucks,stuka,06-10-2009 08:39 PM by stuka,12.0,968.0,gadgets and gaming,2009-06-10 20:39:00, stuka
616,TomTom and Zipcar announce new apps for iPhone,SoundEarphones,06-08-2009 08:50 PM by SoundEarphones,2.0,426.0,gadgets and gaming,2009-06-08 20:50:00, SoundEarphones
617,BB Curve 8900 - coming to VZW anytime soon?,.:Raul,06-08-2009 04:03 PM by .:Raul,5.0,392.0,gadgets and gaming,2009-06-08 16:03:00, .:Raul
618,Xbox warranty extension update,TTM0TION,06-07-2009 12:59 AM by TTM0TION,3.0,493.0,gadgets and gaming,2009-06-07 00:59:00, TTM0TION
619,A little word about SoundEarphones,daryl374,06-04-2009 03:43 PM by daryl374,11.0,899.0,gadgets and gaming,2009-06-04 15:43:00, daryl374
620,My turn for a TV thread,Joeskie,06-04-2009 12:20 PM by Joeskie,2.0,409.0,gadgets and gaming,2009-06-04 12:20:00, Joeskie
621,Official Team Speed Forza Motorsports 3 Tournament,kalifornicationx,10-19-2016 05:28 AM by kalifornicationx,88.0,13838.0,gadgets and gaming,2016-10-19 05:28:00, kalifornicationx
622,"Teamspeed To Go. Download the Teamspeed Mobile app for your iPhone, iPad, or Droid!",TEFF,03-14-2012 12:12 PM by TEFF,12.0,11496.0,gadgets and gaming,2012-03-14 12:12:00, TEFF
623,Now That's A Laptop!  Alienware's Thick Dual GPU Monster,Ced,05-30-2009 11:08 AM by Ced,4.0,471.0,gadgets and gaming,2009-05-30 11:08:00, Ced
624,Ultimate Ears Sale!,BigE,05-29-2009 10:15 PM by BigE,1.0,351.0,gadgets and gaming,2009-05-29 22:15:00, BigE
625,Microsoft poised to enter handheld gaming fray with Zune HD,tractorcrusher,05-28-2009 03:38 PM by tractorcrusher,2.0,443.0,gadgets and gaming,2009-05-28 15:38:00, tractorcrusher
626,Phonak Audeo - Now Available @ SoundEarphones!,SoundEarphones,05-22-2009 10:05 AM by SoundEarphones,0.0,361.0,gadgets and gaming,2009-05-22 10:05:00, SoundEarphones
627,Enemy Territory,QTC,05-19-2009 01:50 PM by QTC,0.0,447.0,gadgets and gaming,2009-05-19 13:50:00, QTC
628,Online PC Gaming?,GLN,05-07-2009 05:52 PM by GLN,20.0,1182.0,gadgets and gaming,2009-05-07 17:52:00, GLN
629,BB Users - noob alert - please advise.,TUUNER,05-07-2009 01:52 AM by TUUNER,34.0,1514.0,gadgets and gaming,2009-05-07 01:52:00, TUUNER
630,New TV time.,stuka,05-04-2009 10:26 PM by stuka,10.0,785.0,gadgets and gaming,2009-05-04 22:26:00, stuka
631,Get in here if you wanna join the Killzone 2 clan!,Tristan,04-26-2009 08:43 AM by Tristan,14.0,738.0,gadgets and gaming,2009-04-26 08:43:00, Tristan
632,PS Audio Sale & Specials!,SoundEarphones,04-25-2009 11:45 AM by SoundEarphones,0.0,609.0,gadgets and gaming,2009-04-25 11:45:00, SoundEarphones
633,"Not a ""Gadget"" per se, but ...",Jo_Switzer,04-24-2009 07:07 PM by Jo_Switzer,0.0,407.0,gadgets and gaming,2009-04-24 19:07:00, Jo_Switzer
634,Diablo III Cinematic Teaser,GuessWho,04-17-2009 03:52 AM by GuessWho,5.0,354.0,gadgets and gaming,2009-04-17 03:52:00, GuessWho
635,Call of Duty: Modern Warfare 2 coming Nov. 10th!!!!,All We'll Drive,04-14-2009 11:50 PM by All We'll Drive,42.0,1917.0,gadgets and gaming,2009-04-14 23:50:00, All We'll Drive
636,SoundEarphones Update & New TS Coupons!,Eric (Plug Guy),04-14-2009 10:41 PM by Eric (Plug Guy),1.0,481.0,gadgets and gaming,2009-04-14 22:41:00, Eric (Plug Guy)
637,COD4 No Scope Sniping Montage,Chris from Cali,04-14-2009 10:11 PM by Chris from Cali,16.0,839.0,gadgets and gaming,2009-04-14 22:11:00, Chris from Cali
638,Alienware computer Inc = suck,Dynamic,04-14-2009 01:26 PM by Dynamic,13.0,875.0,gadgets and gaming,2009-04-14 13:26:00, Dynamic
639,PS Audio - Now Available @ SoundEarphones,SoundEarphones,04-11-2009 11:36 AM by SoundEarphones,0.0,336.0,gadgets and gaming,2009-04-11 11:36:00, SoundEarphones
640,"BlackBerry OS 5.0 previewed on video, don't expect a revolution",DJ,04-09-2009 11:52 AM by DJ,0.0,444.0,gadgets and gaming,2009-04-09 11:52:00, DJ
641,Ultrasone Edition 9 Headphone Sale!,SoundEarphones,04-06-2009 10:27 AM by SoundEarphones,0.0,682.0,gadgets and gaming,2009-04-06 10:27:00, SoundEarphones
642,Video Card Wars Heat Up Again . . .,Barrister,04-03-2009 02:24 AM by Barrister,0.0,339.0,gadgets and gaming,2009-04-03 02:24:00, Barrister
643,Official Team Speed Forza Motorsports 3 Tournament,kalifornicationx,10-19-2016 05:28 AM by kalifornicationx,88.0,13838.0,gadgets and gaming,2016-10-19 05:28:00, kalifornicationx
644,"Teamspeed To Go. Download the Teamspeed Mobile app for your iPhone, iPad, or Droid!",TEFF,03-14-2012 12:12 PM by TEFF,12.0,11496.0,gadgets and gaming,2012-03-14 12:12:00, TEFF
645,New LED TV's (3rd Gen) from Samsung,stuka,04-01-2009 05:37 PM by stuka,7.0,735.0,gadgets and gaming,2009-04-01 17:37:00, stuka
646,PSN IDs,Chris from Cali,04-01-2009 04:11 PM by Chris from Cali,6.0,517.0,gadgets and gaming,2009-04-01 16:11:00, Chris from Cali
647,Gamertags,///Milan,03-26-2009 11:04 PM by ///Milan,9.0,649.0,gadgets and gaming,2009-03-26 23:04:00, ///Milan
648,World's Largest HD Plasma Display,Joeskie,03-26-2009 01:18 PM by Joeskie,9.0,925.0,gadgets and gaming,2009-03-26 13:18:00, Joeskie
649,PS3 players...,Gobbles,03-25-2009 05:03 PM by Gobbles,5.0,457.0,gadgets and gaming,2009-03-25 17:03:00, Gobbles
650,VIDEO: Sega's classic OutRun returning on XBox Live,DJ,03-24-2009 11:52 PM by DJ,0.0,426.0,gadgets and gaming,2009-03-24 23:52:00, DJ
651,Resident Evil 5,StrikerX50,03-22-2009 11:02 AM by StrikerX50,4.0,426.0,gadgets and gaming,2009-03-22 11:02:00, StrikerX50
652,PC WORLD Lists Most Violent Video Games of All Time,Andrew,03-19-2009 03:39 PM by Andrew,7.0,482.0,gadgets and gaming,2009-03-19 15:39:00, Andrew
653,Recommend a video game Console,GrayTT,03-18-2009 08:27 AM by GrayTT,29.0,2398.0,gadgets and gaming,2009-03-18 08:27:00, GrayTT
654,Baseball Is Back!!!,Dave S,03-12-2009 06:02 PM by Dave S,13.0,733.0,gadgets and gaming,2009-03-12 18:02:00, Dave S
655,Killzone 2,Dynamic,03-12-2009 03:41 PM by Dynamic,29.0,1053.0,gadgets and gaming,2009-03-12 15:41:00, Dynamic
656,"Input on ""budget"" home theater",Andrew,03-12-2009 10:13 AM by Andrew,10.0,756.0,gadgets and gaming,2009-03-12 10:13:00, Andrew
657,JAYS c-JAYS On Sale!,SoundEarphones,03-11-2009 08:22 PM by SoundEarphones,0.0,376.0,gadgets and gaming,2009-03-11 20:22:00, SoundEarphones
658,Good example of 720p vs 1080i - GT5: Prologue,cstroked,03-11-2009 04:39 PM by cstroked,9.0,963.0,gadgets and gaming,2009-03-11 16:39:00, cstroked
659,Shure Blowout Sale,SoundEarphones,03-11-2009 09:56 AM by SoundEarphones,5.0,459.0,gadgets and gaming,2009-03-11 09:56:00, SoundEarphones
660,"Holy hell, 24SSD drives in RAID",ohhaiguys,03-10-2009 07:54 PM by ohhaiguys,12.0,673.0,gadgets and gaming,2009-03-10 19:54:00, ohhaiguys
661,Shure SE115 - Now In Stock!,SoundEarphones,03-10-2009 11:00 AM by SoundEarphones,0.0,397.0,gadgets and gaming,2009-03-10 11:00:00, SoundEarphones
662,Red Alert sucked donkey bawls,strebo,03-08-2009 07:25 PM by strebo,11.0,706.0,gadgets and gaming,2009-03-08 19:25:00, strebo
663,"Halo Wars, anyone?",Alzilla,03-04-2009 04:04 PM by Alzilla,8.0,382.0,gadgets and gaming,2009-03-04 16:04:00, Alzilla
664,Fallout 3: The Pitt DLC,Bluestrike2,03-02-2009 05:43 PM by Bluestrike2,0.0,339.0,gadgets and gaming,2009-03-02 17:43:00, Bluestrike2
665,Official Team Speed Forza Motorsports 3 Tournament,kalifornicationx,10-19-2016 05:28 AM by kalifornicationx,88.0,13838.0,gadgets and gaming,2016-10-19 05:28:00, kalifornicationx
666,"Teamspeed To Go. Download the Teamspeed Mobile app for your iPhone, iPad, or Droid!",TEFF,03-14-2012 12:12 PM by TEFF,12.0,11496.0,gadgets and gaming,2012-03-14 12:12:00, TEFF
667,COD4 on PS3 - WTF,TTM0TION,03-01-2009 12:34 PM by TTM0TION,4.0,332.0,gadgets and gaming,2009-03-01 12:34:00, TTM0TION
668,Sleek new Studio XPS 435 materializes on Dell website,cleanme,02-25-2009 11:24 AM by cleanme,2.0,441.0,gadgets and gaming,2009-02-25 11:24:00, cleanme
669,Any Street Fighter IV Players on PS3?,willmiz,02-24-2009 02:56 PM by willmiz,10.0,597.0,gadgets and gaming,2009-02-24 14:56:00, willmiz
670,"Hulu, comp hook up to Comp, and Magic Jack",.:Raul,02-23-2009 05:52 PM by .:Raul,6.0,619.0,gadgets and gaming,2009-02-23 17:52:00, .:Raul
671,Race Pro (X360),Winchm60,02-19-2009 09:17 PM by Winchm60,3.0,374.0,gadgets and gaming,2009-02-19 21:17:00, Winchm60
672,SoundEarphones Sale!,LittleJohny,02-19-2009 12:08 AM by LittleJohny,15.0,673.0,gadgets and gaming,2009-02-19 00:08:00, LittleJohny
673,Blizzard-Activision Posts Q4 Loss Despite Record Revenue,Dynamic,02-18-2009 08:33 PM by Dynamic,6.0,341.0,gadgets and gaming,2009-02-18 20:33:00, Dynamic
674,Shure Sale,SoundEarphones,02-16-2009 10:17 PM by SoundEarphones,2.0,380.0,gadgets and gaming,2009-02-16 22:17:00, SoundEarphones
675,Early Reviews of Kill Zone 2 Not Very Good,Barrister,02-16-2009 09:14 PM by Barrister,5.0,354.0,gadgets and gaming,2009-02-16 21:14:00, Barrister
676,Porsche Design Mobile Phone P'9522,quattro joe,02-15-2009 07:35 PM by quattro joe,10.0,891.0,gadgets and gaming,2009-02-15 19:35:00, quattro joe
677,T-Mobile bringing the BlackBerry Curve 8900 in February,DJ,02-15-2009 12:31 PM by DJ,19.0,1242.0,gadgets and gaming,2009-02-15 12:31:00, DJ
678,AWESOME Wii game- The House of The Dead- Overkill,ajindfw,02-15-2009 12:56 AM by ajindfw,0.0,359.0,gadgets and gaming,2009-02-15 00:56:00, ajindfw
679,"Virtual Rape Game - ""Rapelay"" - Banned By Amazon",NotSoMiniC,02-14-2009 02:58 AM by NotSoMiniC,3.0,399.0,gadgets and gaming,2009-02-14 02:58:00, NotSoMiniC
680,iBee Farting - Awesome Blackberry Application !,DJ,02-10-2009 09:04 PM by DJ,0.0,1419.0,gadgets and gaming,2009-02-10 21:04:00, DJ
681,HOLY CRAP!! If You Have Ever Played Guitar Hero This is a Must LOOK!,chokeu2,02-09-2009 09:21 PM by chokeu2,4.0,388.0,gadgets and gaming,2009-02-09 21:21:00, chokeu2
682,Now Here's A Cool Game Release This Week,cleanme,02-08-2009 02:15 PM by cleanme,5.0,341.0,gadgets and gaming,2009-02-08 14:15:00, cleanme
683,Ultrasone - Now Available @ SoundEarphones,SoundEarphones,02-07-2009 01:21 PM by SoundEarphones,0.0,333.0,gadgets and gaming,2009-02-07 13:21:00, SoundEarphones
